--------[ AIDA64 Extreme ]----------------------------------------------------------------------------------------------

    Версия                                            AIDA64 v6.60.5900/ru
    Тестовый модуль                                   4.5.865.8-x64
    Домашняя страница                                 http://www.aida64.com/
    Тип отчёта                                        Быстрый отчёт
    Компьютер                                         DESKTOP-3RV1MEH
    Генератор                                         vlads
    Операционная система                              Microsoft Windows 10 Home Single Language 10.0.19043.1526 (Win10 21H1 May 2021 Update)
    Дата                                              2022-02-24
    Время                                             19:56


--------[ Аудио Windows ]-----------------------------------------------------------------------------------------------

    midi-out.0   0001 001B  Microsoft GS Wavetable Synth
    mixer.0      0001 0068  Динамики (Realtek High Definiti
    wave-out.0   0001 0064  Динамики (Realtek High Definiti


--------[ Аудио PCI / PnP ]---------------------------------------------------------------------------------------------

    nVIDIA GK208 HDMI/DP @ nVIDIA GK208 - High Definition Audio Controller            PCI
    Realtek ALC662 @ Intel Lynx Point PCH - High Definition Audio Controller [C2]     PCI


--------[ HD Audio ]----------------------------------------------------------------------------------------------------

  [ Intel Lynx Point PCH - High Definition Audio Controller [C2] ]

    Свойства устройства:
      Описание устройства                               Intel Lynx Point PCH - High Definition Audio Controller [C2]
      Описание устройства (Windows)                     Контроллер High Definition Audio (Microsoft)
      Тип шины                                          PCI
      Шина / Устройство / Функция                       0 / 27 / 0
      ID устройства                                     8086-8C20
      Субсистемный идентификатор                        17AA-367D
      Версия                                            05
      Аппаратный ID                                     PCI\VEN_8086&DEV_8C20&SUBSYS_367D17AA&REV_05

    Производитель устройства:
      Фирма                                             Intel Corporation
      Информация о продукте                             https://www.intel.com/products/chipsets
      Загрузка драйверов                                https://www.intel.com/support/chipsets
      Модернизации BIOS                                 http://www.aida64.com/goto/?p=biosupdates
      Обновление драйверов                              http://www.aida64.com/goto/?p=drvupdates

  [ Realtek ALC662 ]

    Свойства устройства:
      Описание устройства                               Realtek ALC662
      Описание устройства (Windows)                     Realtek High Definition Audio
      Тип устройства                                    Audio
      Тип шины                                          HDAUDIO
      ID устройства                                     10EC-0662
      Субсистемный идентификатор                        17AA-367D
      Версия                                            1003
      Аппаратный ID                                     HDAUDIO\FUNC_01&VEN_10EC&DEV_0662&SUBSYS_17AA367D&REV_1003

    Производитель устройства:
      Фирма                                             Realtek Semiconductor Corp.
      Информация о продукте                             https://www.realtek.com/products
      Загрузка драйверов                                https://www.realtek.com/downloads
      Обновление драйверов                              http://www.aida64.com/goto/?p=drvupdates

  [ nVIDIA GK208 - High Definition Audio Controller ]

    Свойства устройства:
      Описание устройства                               nVIDIA GK208 - High Definition Audio Controller
      Описание устройства (Windows)                     Контроллер High Definition Audio (Microsoft)
      Тип шины                                          PCI
      Шина / Устройство / Функция                       1 / 0 / 1
      ID устройства                                     10DE-0E0F
      Субсистемный идентификатор                        1462-2922
      Версия                                            A1
      Аппаратный ID                                     PCI\VEN_10DE&DEV_0E0F&SUBSYS_29221462&REV_A1

    Производитель устройства:
      Фирма                                             NVIDIA Corporation
      Информация о продукте                             https://www.nvidia.com/page/mobo.html
      Загрузка драйверов                                https://www.nvidia.com/Download/index.aspx
      Модернизации BIOS                                 http://www.aida64.com/goto/?p=biosupdates
      Обновление драйверов                              http://www.aida64.com/goto/?p=drvupdates

  [ nVIDIA GK208 HDMI/DP ]

    Свойства устройства:
      Описание устройства                               nVIDIA GK208 HDMI/DP
      Описание устройства (Windows)                     NVIDIA High Definition Audio
      Тип устройства                                    Audio
      Тип шины                                          HDAUDIO
      ID устройства                                     10DE-0051
      Субсистемный идентификатор                        1462-2922
      Версия                                            1001
      Аппаратный ID                                     HDAUDIO\FUNC_01&VEN_10DE&DEV_0051&SUBSYS_14622922&REV_1001

    Производитель устройства:
      Фирма                                             NVIDIA Corporation
      Информация о продукте                             https://www.nvidia.com/page/mobo.html
      Загрузка драйверов                                https://www.nvidia.com/Download/index.aspx
      Обновление драйверов                              http://www.aida64.com/goto/?p=drvupdates


--------[ OpenAL ]------------------------------------------------------------------------------------------------------

    Свойства OpenAL:
      Производитель                                     Creative Labs Inc.
      Renderer                                          Программы
      Версия                                            1.1
      Имя устройства                                    Generic Software
      OpenAL DLL                                        6.14.0357.24
      Creative OpenAL DLL                               Нет
      Wrapper DLL                                       2.2.0.5
      Аппаратные звуковые буферы                        0
      X-RAM                                             Нет

    Расширения OpenAL:
      AL_EXT_EXPONENT_DISTANCE                          Поддерживается
      AL_EXT_LINEAR_DISTANCE                            Поддерживается
      AL_EXT_OFFSET                                     Поддерживается
      ALC_ENUMERATE_ALL_EXT                             Поддерживается
      ALC_ENUMERATION_EXT                               Поддерживается
      ALC_EXT_CAPTURE                                   Поддерживается
      ALC_EXT_EFX                                       Поддерживается
      EAX                                               Поддерживается
      EAX2.0                                            Поддерживается
      EAX3.0                                            Не поддерживается
      EAX3.0EMULATED                                    Поддерживается
      EAX4.0                                            Не поддерживается
      EAX4.0EMULATED                                    Поддерживается
      EAX5.0                                            Не поддерживается
      EAX-RAM                                           Не поддерживается


--------[ Кодеки аудио ]------------------------------------------------------------------------------------------------

  [ Fraunhofer IIS MPEG Layer-3 Codec (decode only) ]

    Свойства драйвера ACM:
      Описание драйвера                                 Fraunhofer IIS MPEG Layer-3 Codec (decode only)
      Copyright-строка                                  Copyright © 1996-1999 Fraunhofer Institut Integrierte Schaltungen IIS
      Функции драйвера                                  decoder only version
      Версия драйвера                                   1.09

  [ Кодек ADPCM (Microsoft) ]

    Свойства драйвера ACM:
      Описание драйвера                                 Кодек ADPCM (Microsoft)
      Copyright-строка                                  © Корпорация Майкрософт, 1992-1996.
      Функции драйвера                                  Сжатие и распаковка аудиозаписей Microsoft ADPCM.
      Версия драйвера                                   4.00

  [ Кодек CCITT G.711 A-Law и u-Law (Microsoft) ]

    Свойства драйвера ACM:
      Описание драйвера                                 Кодек CCITT G.711 A-Law и u-Law (Microsoft)
      Copyright-строка                                  (С) Корпорация Майкрософт, 1993-1996.
      Функции драйвера                                  Сжатие и распаковка аудиозаписей CCITT G.711 A-Law / u-Law.
      Версия драйвера                                   4.00

  [ Кодек GSM 6.10 (Microsoft) ]

    Свойства драйвера ACM:
      Описание драйвера                                 Кодек GSM 6.10 (Microsoft)
      Copyright-строка                                  (С) Корпорация Майкрософт, 1993-1996.
      Функции драйвера                                  Сжатие и распаковка аудиозаписей в соответствии со стандартом ETSI-GSM (European Telecommunications Standards Institute-Groupe Special Mobile) версии 6.10.
      Версия драйвера                                   4.00

  [ Кодек IMA ADPCM (Microsoft) ]

    Свойства драйвера ACM:
      Описание драйвера                                 Кодек IMA ADPCM (Microsoft)
      Copyright-строка                                  © Корпорация Майкрософт, 1992-1996.
      Функции драйвера                                  Сжатие и распаковка аудиозаписей IMA ADPCM.
      Версия драйвера                                   4.00

  [ Конвертор PCM Microsoft ]

    Свойства драйвера ACM:
      Описание драйвера                                 Конвертор PCM Microsoft
      Copyright-строка                                  © Корпорация Майкрософт, 1992-1996.
      Функции драйвера                                  Изменение частоты и количества бит для аудиозаписей PCM.
      Версия драйвера                                   5.00


--------[ Кодеки видео ]------------------------------------------------------------------------------------------------

    iccvid.dll                 1.10.0.11                           Кодек Cinepak®
    iyuv_32.dll                10.0.19041.1165 (WinBuild.160101.0800)  Intel Indeo(R) Video YUV кодек
    msrle32.dll                10.0.19041.1 (WinBuild.160101.0800)  Microsoft RLE Compressor
    msvidc32.dll               10.0.19041.1165 (WinBuild.160101.0800)  Программа сжатия Microsoft Video 1
    msyuv.dll                  10.0.19041.1 (WinBuild.160101.0800)  Microsoft UYVY Video Decompressor
    tsbyuv.dll                 10.0.19041.1 (WinBuild.160101.0800)  Toshiba Video Codec


--------[ MCI ]---------------------------------------------------------------------------------------------------------

  [ AVIVideo ]

    Свойства устройства MCI:
      Устройство                                        AVIVideo
      Имя                                               Видео для Windows
      Описание                                          Драйвер MCI Video для Windows
      Тип                                               Digital Video Device
      Драйвер                                           mciavi32.dll
      Статус                                            Разрешено

    Функции устройства MCI:
      Составное устройство                              Да
      Устройство на базе файлов                         Да
      Извлечение носителя                               Нет
      Воспроизведение                                   Да
      Обратное воспроизведение                          Да
      Запись                                            Нет
      Сохранение данных                                 Нет
      Заморозка данных                                  Нет
      Блокирование данных                               Нет
      Растяжение кадра                                  Да
      Растяжение ввода                                  Нет
      Тестирование                                      Да
      Поддержка аудио                                   Да
      Поддержка видео                                   Да
      Поддержка фотоизображений                         Нет

  [ CDAudio ]

    Свойства устройства MCI:
      Устройство                                        CDAudio
      Имя                                               Компакт-диск
      Описание                                          Драйвер MCI для устройств cdaudio
      Тип                                               CD Audio Device
      Драйвер                                           mcicda.dll
      Статус                                            Разрешено

    Функции устройства MCI:
      Составное устройство                              Нет
      Устройство на базе файлов                         Нет
      Извлечение носителя                               Да
      Воспроизведение                                   Да
      Запись                                            Нет
      Сохранение данных                                 Нет
      Поддержка аудио                                   Да
      Поддержка видео                                   Нет

  [ MPEGVideo ]

    Свойства устройства MCI:
      Устройство                                        MPEGVideo
      Имя                                               DirectShow
      Описание                                          Драйвер MCI DirectShow
      Тип                                               Digital Video Device
      Драйвер                                           mciqtz32.dll
      Статус                                            Разрешено

    Функции устройства MCI:
      Составное устройство                              Да
      Устройство на базе файлов                         Да
      Извлечение носителя                               Нет
      Воспроизведение                                   Да
      Обратное воспроизведение                          Нет
      Запись                                            Нет
      Сохранение данных                                 Нет
      Заморозка данных                                  Нет
      Блокирование данных                               Нет
      Растяжение кадра                                  Да
      Растяжение ввода                                  Нет
      Тестирование                                      Да
      Поддержка аудио                                   Да
      Поддержка видео                                   Да
      Поддержка фотоизображений                         Нет

  [ Sequencer ]

    Свойства устройства MCI:
      Устройство                                        Sequencer
      Имя                                               Секвенсор MIDI
      Описание                                          Драйвер MCI для секвенсора MIDI
      Тип                                               Sequencer Device
      Драйвер                                           mciseq.dll
      Статус                                            Разрешено

    Функции устройства MCI:
      Составное устройство                              Да
      Устройство на базе файлов                         Да
      Извлечение носителя                               Нет
      Воспроизведение                                   Да
      Запись                                            Нет
      Сохранение данных                                 Нет
      Поддержка аудио                                   Да
      Поддержка видео                                   Нет

  [ WaveAudio ]

    Свойства устройства MCI:
      Устройство                                        WaveAudio
      Имя                                               Sound
      Описание                                          Драйвер MCI для устройств звукозаписи
      Тип                                               Waveform Audio Device
      Драйвер                                           mciwave.dll
      Статус                                            Разрешено

    Функции устройства MCI:
      Составное устройство                              Да
      Устройство на базе файлов                         Да
      Извлечение носителя                               Нет
      Воспроизведение                                   Да
      Запись                                            Нет
      Сохранение данных                                 Да
      Поддержка аудио                                   Да
      Поддержка видео                                   Нет


--------[ SAPI ]--------------------------------------------------------------------------------------------------------

    Свойства SAPI:
      Версия SAPI4                                      -
      Версия SAPI5                                      5.3.25307.0

    Голос (SAPI5):
      Имя                                               Microsoft Irina Desktop - Russian
      Путь голоса                                       C:\Windows\Speech_OneCore\Engines\TTS\ru-RU\M1049Irina
      Возраст                                           Взрослый
      Пол                                               Женский
      Язык                                              Русский (Россия)
      Производитель                                     Microsoft
      Версия                                            11.0
      Файл DLL                                          C:\Windows\SysWOW64\speech_onecore\engines\tts\MSTTSEngine_OneCore.dll  (x86)
      CLSID                                             {179F3D56-1B0B-42B2-A962-59B7EF59FE1B}

    Голос (SAPI5):
      Имя                                               Microsoft Zira Desktop - English (United States)
      Путь голоса                                       C:\Windows\Speech\Engines\TTS\en-US\M1033ZIR
      Возраст                                           Взрослый
      Пол                                               Женский
      Язык                                              Английский (США)
      Производитель                                     Microsoft
      Версия                                            11.0
      Файл DLL                                          C:\Windows\SysWOW64\speech\engines\tts\MSTTSEngine.dll  (x86)
      CLSID                                             {C64501F6-E6E6-451f-A150-25D0839BC510}


--------[ Debug - PCI ]-------------------------------------------------------------------------------------------------

    B00 D00 F00:  Intel Haswell-DT - Host Bridge/DRAM Controller
                  
      Offset 000:  86 80 00 0C  06 00 90 20  06 00 00 06  00 00 00 00 
      Offset 010:  00 00 00 00  00 00 00 00  00 00 00 00  00 00 00 00 
      Offset 020:  00 00 00 00  00 00 00 00  00 00 00 00  AA 17 7D 36 
      Offset 030:  00 00 00 00  E0 00 00 00  00 00 00 00  00 00 00 00 
      Offset 040:  01 90 D1 FE  00 00 00 00  01 00 D1 FE  00 00 00 00 
      Offset 050:  03 00 00 00  09 00 00 00  04 00 00 00  01 00 00 DF 
      Offset 060:  05 00 00 F8  00 00 00 00  01 80 D1 FE  00 00 00 00 
      Offset 070:  00 00 00 FF  01 00 00 00  00 0C 00 FF  7F 00 00 00 
      Offset 080:  10 00 00 00  00 00 00 00  1A 00 00 00  00 00 00 00 
      Offset 090:  01 00 00 FF  01 00 00 00  01 00 F0 1E  02 00 00 00 
      Offset 0A0:  01 00 00 00  02 00 00 00  01 00 00 1F  02 00 00 00 
      Offset 0B0:  01 00 00 E0  01 00 00 E0  01 00 00 DF  01 00 00 E0 
      Offset 0C0:  00 00 00 00  00 00 00 00  00 00 00 00  00 00 00 00 
      Offset 0D0:  00 00 00 00  00 00 00 00  00 00 00 00  00 00 00 00 
      Offset 0E0:  09 00 0C 01  61 E0 04 62  D0 00 54 56  00 00 00 00 
      Offset 0F0:  00 00 00 00  C8 0F 03 00  00 00 00 00  00 00 00 00 

    B00 D01 F00:  Intel Haswell - PCI Express x16 Controller
                  
      Offset 000:  86 80 01 0C  07 04 10 00  06 00 04 06  10 00 81 00 
      Offset 010:  00 00 00 00  00 00 00 00  00 01 01 00  E0 E0 00 20 
      Offset 020:  00 F6 00 F7  01 E8 F1 F1  00 00 00 00  00 00 00 00 
      Offset 030:  00 00 00 00  88 00 00 00  00 00 00 00  00 01 18 00 
      Offset 040:  00 00 00 00  00 00 00 00  00 00 00 00  00 00 00 00 
      Offset 050:  00 00 00 00  00 00 00 00  00 00 00 00  00 00 00 00 
      Offset 060:  00 00 00 00  00 00 00 00  00 00 00 00  00 00 00 00 
      Offset 070:  00 00 00 00  00 00 00 00  00 00 00 00  00 00 00 0A 
      Offset 080:  01 90 03 C8  08 00 00 00  0D 80 00 00  AA 17 7D 36 
      Offset 090:  05 A0 01 00  38 01 E0 FE  00 00 00 00  00 00 00 00 
      Offset 0A0:  10 00 42 01  00 80 00 00  00 00 00 00  02 AD 61 02 
      Offset 0B0:  41 00 82 D0  80 25 0C 00  00 00 40 00  08 00 00 00 
      Offset 0C0:  00 00 00 00  80 0B 08 00  00 04 00 00  06 00 00 00 
      Offset 0D0:  42 00 01 00  00 00 00 00  00 00 00 00  00 00 00 00 
      Offset 0E0:  00 00 00 00  00 00 00 00  00 00 00 00  00 00 00 00 
      Offset 0F0:  00 60 01 00  4E 01 01 40  00 00 00 00  00 00 10 00 

    B00 D14 F00:  Intel Lynx Point PCH - USB 3.0 xHCI Host Controller [C2]
                  
      Offset 000:  86 80 31 8C  06 04 90 02  05 30 03 0C  00 00 00 00 
      Offset 010:  04 00 20 F7  00 00 00 00  00 00 00 00  00 00 00 00 
      Offset 020:  00 00 00 00  00 00 00 00  00 00 00 00  AA 17 7D 36 
      Offset 030:  00 00 00 00  70 00 00 00  00 00 00 00  00 01 00 00 
      Offset 040:  FD 01 36 80  89 C6 0F 80  00 00 00 00  00 00 00 00 
      Offset 050:  9F 6E 88 07  00 00 00 00  00 00 00 00  00 00 00 00 
      Offset 060:  30 20 00 00  00 00 00 00  00 00 00 00  00 00 00 00 
      Offset 070:  01 80 C2 C1  08 00 00 00  00 00 00 00  00 00 00 00 
      Offset 080:  05 00 87 00  58 02 E0 FE  00 00 00 00  00 00 00 00 
      Offset 090:  00 00 00 00  00 00 00 00  00 00 00 00  00 00 00 00 
      Offset 0A0:  40 01 00 00  00 00 00 00  00 00 00 00  00 00 00 00 
      Offset 0B0:  0F 00 01 00  00 00 00 00  00 00 00 00  00 00 00 00 
      Offset 0C0:  03 0C 00 20  00 00 0F 00  03 0C 30 00  00 00 00 00 
      Offset 0D0:  FF 00 00 00  FF 00 00 00  03 00 00 00  03 00 00 00 
      Offset 0E0:  F4 01 00 00  00 00 00 00  00 00 00 00  D8 D8 D8 08 
      Offset 0F0:  00 00 00 00  00 00 00 00  B1 0F 06 08  00 00 00 00 

    B00 D16 F00:  Intel Lynx Point PCH - Host Embedded Controller Interface 1 (HECI1) [C1]
                  
      Offset 000:  86 80 3A 8C  06 04 10 00  04 00 80 07  00 00 80 00 
      Offset 010:  04 A0 21 F7  00 00 00 00  00 00 00 00  00 00 00 00 
      Offset 020:  00 00 00 00  00 00 00 00  00 00 00 00  AA 17 7D 36 
      Offset 030:  00 00 00 00  50 00 00 00  00 00 00 00  00 01 00 00 
      Offset 040:  45 02 00 1E  10 00 01 80  06 23 00 60  F0 1F 00 10 
      Offset 050:  01 8C 03 C8  08 00 00 00  00 00 00 00  00 00 00 00 
      Offset 060:  00 02 00 00  00 00 00 00  00 00 00 00  00 00 00 00 
      Offset 070:  00 00 00 00  00 00 00 E0  00 00 00 00  00 00 00 00 
      Offset 080:  00 00 00 00  00 00 00 00  00 00 00 00  05 00 81 00 
      Offset 090:  38 02 E0 FE  00 00 00 00  00 00 00 00  00 00 00 00 
      Offset 0A0:  00 00 00 00  00 00 00 00  00 00 00 00  00 00 00 00 
      Offset 0B0:  00 00 00 00  00 00 00 00  00 00 00 00  02 00 00 C0 
      Offset 0C0:  55 D9 46 C0  38 60 05 52  76 F6 63 4E  79 FF 87 8E 
      Offset 0D0:  07 10 99 F0  1C 95 6D 24  31 94 AE E6  67 B7 F5 B6 
      Offset 0E0:  00 00 00 00  00 00 00 00  00 00 00 00  00 00 00 00 
      Offset 0F0:  00 00 00 00  00 00 00 00  00 00 00 00  00 00 00 00 

    B00 D1A F00:  Intel Lynx Point PCH - USB 2.0 EHCI Host Controller 2 [C2]
                  
      Offset 000:  86 80 2D 8C  06 00 90 02  05 20 03 0C  00 00 00 00 
      Offset 010:  00 80 21 F7  00 00 00 00  00 00 00 00  00 00 00 00 
      Offset 020:  00 00 00 00  00 00 00 00  00 00 00 00  AA 17 7D 36 
      Offset 030:  00 00 00 00  50 00 00 00  00 00 00 00  10 01 00 00 
      Offset 040:  00 00 00 00  4D 1C 99 3D  00 00 00 00  00 00 00 00 
      Offset 050:  01 58 C2 C9  00 00 00 00  0A 98 A0 20  00 00 00 00 
      Offset 060:  20 20 FF 07  00 00 00 00  01 00 00 00  00 20 00 C0 
      Offset 070:  00 00 DF 3F  00 00 0F 00  4F 01 00 00  8C 40 00 00 
      Offset 080:  00 00 80 00  11 88 0C 93  70 0D 00 24  01 04 02 00 
      Offset 090:  00 00 00 00  00 00 00 00  13 00 06 03  00 00 00 00 
      Offset 0A0:  00 00 00 00  00 00 00 00  00 00 00 00  00 00 00 00 
      Offset 0B0:  00 00 00 00  00 00 00 00  00 00 00 00  00 00 00 00 
      Offset 0C0:  00 00 00 00  00 00 00 00  00 00 00 00  00 00 00 00 
      Offset 0D0:  00 00 00 00  00 AA FF 00  00 00 FF FF  27 00 00 00 
      Offset 0E0:  00 00 00 00  00 00 00 00  00 00 00 00  04 80 BE DD 
      Offset 0F0:  00 00 00 00  88 85 80 00  B1 0F 06 08  08 17 1A 20 

    B00 D1B F00:  Intel Lynx Point PCH - High Definition Audio Controller [C2]
                  
      Offset 000:  86 80 20 8C  06 00 10 00  05 00 03 04  10 00 00 00 
      Offset 010:  04 C0 AF FE  00 00 00 00  00 00 00 00  00 00 00 00 
      Offset 020:  00 00 00 00  00 00 00 00  00 00 00 00  AA 17 7D 36 
      Offset 030:  00 00 00 00  50 00 00 00  00 00 00 00  16 01 00 00 
      Offset 040:  03 00 00 17  00 00 00 00  00 00 00 00  00 80 00 00 
      Offset 050:  01 60 42 C8  00 00 00 00  00 00 00 00  00 00 00 00 
      Offset 060:  05 70 80 00  00 00 00 00  00 00 00 00  00 00 00 00 
      Offset 070:  10 00 91 00  00 00 00 10  00 08 10 00  00 00 00 00 
      Offset 080:  00 00 00 00  00 00 00 00  00 00 00 00  00 00 00 00 
      Offset 090:  00 00 00 00  00 00 00 00  00 00 00 00  00 00 00 00 
      Offset 0A0:  00 00 00 00  00 00 00 00  00 00 00 00  00 00 00 00 
      Offset 0B0:  00 00 00 00  00 00 00 00  00 00 00 00  00 00 00 00 
      Offset 0C0:  00 04 02 01  00 60 00 00  00 0C 85 82  10 00 33 02 
      Offset 0D0:  00 0C 85 02  10 00 33 02  00 00 00 00  00 00 00 00 
      Offset 0E0:  00 00 00 00  00 00 00 00  00 00 00 00  00 00 00 00 
      Offset 0F0:  00 00 00 00  00 00 00 00  B1 0F 06 08  00 00 00 00 

    B00 D1C F00:  Intel Lynx Point PCH - PCI Express Root Port 1 [C2]
                  
      Offset 000:  86 80 10 8C  04 04 10 00  D5 00 04 06  10 00 81 00 
      Offset 010:  00 00 00 00  00 00 00 00  00 02 02 00  F0 00 00 20 
      Offset 020:  F0 FF 00 00  F1 FF 01 00  00 00 00 00  00 00 00 00 
      Offset 030:  00 00 00 00  40 00 00 00  00 00 00 00  00 01 00 00 
      Offset 040:  10 80 42 01  00 80 00 00  00 00 10 00  12 4C 31 01 
      Offset 050:  03 00 01 10  60 00 04 00  28 10 00 00  08 00 00 00 
      Offset 060:  00 00 00 00  17 08 08 00  00 04 00 00  00 00 00 00 
      Offset 070:  01 00 01 00  00 00 00 00  00 00 00 00  00 00 00 00 
      Offset 080:  05 90 01 00  78 01 E0 FE  00 00 00 00  00 00 00 00 
      Offset 090:  0D A0 00 00  AA 17 7D 36  00 00 00 00  00 00 00 00 
      Offset 0A0:  01 00 03 C8  00 00 00 00  00 00 00 00  00 00 00 00 
      Offset 0B0:  00 00 00 00  00 00 00 00  00 00 00 00  00 00 00 00 
      Offset 0C0:  00 00 00 00  00 00 00 00  00 00 00 00  00 00 00 00 
      Offset 0D0:  00 00 00 01  00 08 00 00  02 00 11 09  00 00 00 00 
      Offset 0E0:  00 3F 00 00  00 00 00 00  03 00 00 00  00 00 00 00 
      Offset 0F0:  50 00 00 00  80 F5 00 00  B1 0F 06 08  B0 03 02 01 

    B00 D1C F02:  Intel Lynx Point PCH - PCI Express Root Port 3 [C2]
                  
      Offset 000:  86 80 14 8C  07 04 10 00  D5 00 04 06  10 00 81 00 
      Offset 010:  00 00 00 00  00 00 00 00  00 03 03 00  D0 D0 00 00 
      Offset 020:  10 F7 10 F7  11 F2 11 F2  00 00 00 00  00 00 00 00 
      Offset 030:  00 00 00 00  40 00 00 00  00 00 00 00  00 03 00 00 
      Offset 040:  10 80 42 01  00 80 00 00  00 00 10 00  12 3C 32 03 
      Offset 050:  40 00 11 70  00 B2 14 00  00 00 40 00  08 00 00 00 
      Offset 060:  00 00 00 00  17 08 00 00  00 04 00 00  00 00 00 00 
      Offset 070:  02 00 01 00  00 00 00 00  00 00 00 00  00 00 00 00 
      Offset 080:  05 90 01 00  58 01 E0 FE  00 00 00 00  00 00 00 00 
      Offset 090:  0D A0 00 00  AA 17 7D 36  00 00 00 00  00 00 00 00 
      Offset 0A0:  01 00 03 C8  00 00 00 00  00 00 00 00  00 00 00 00 
      Offset 0B0:  00 00 00 00  00 00 00 00  00 00 00 00  00 00 00 00 
      Offset 0C0:  00 00 00 00  00 00 00 00  00 00 00 00  00 00 00 00 
      Offset 0D0:  00 00 00 01  02 08 00 00  08 80 11 0B  00 00 00 00 
      Offset 0E0:  00 03 00 00  00 00 3C 88  11 00 00 00  00 00 00 00 
      Offset 0F0:  50 00 00 00  40 00 00 0C  B1 0F 06 08  B0 03 00 03 

    B00 D1D F00:  Intel Lynx Point PCH - USB 2.0 EHCI Host Controller 1 [C2]
                  
      Offset 000:  86 80 26 8C  06 00 90 02  05 20 03 0C  00 00 00 00 
      Offset 010:  00 70 21 F7  00 00 00 00  00 00 00 00  00 00 00 00 
      Offset 020:  00 00 00 00  00 00 00 00  00 00 00 00  AA 17 7D 36 
      Offset 030:  00 00 00 00  50 00 00 00  00 00 00 00  17 01 00 00 
      Offset 040:  00 00 00 00  DB 05 9A 09  00 00 00 00  00 00 00 00 
      Offset 050:  01 58 C2 C9  00 00 00 00  0A 98 A0 20  00 00 00 00 
      Offset 060:  20 20 FF 07  00 00 00 00  01 00 00 00  00 20 00 C0 
      Offset 070:  00 00 DF 3F  03 0C 00 20  4F 01 00 00  8C 40 00 00 
      Offset 080:  00 00 80 00  11 88 0C 93  70 0D 00 24  01 04 02 00 
      Offset 090:  00 00 00 00  00 00 00 00  13 00 06 03  00 00 00 00 
      Offset 0A0:  00 00 00 00  00 00 00 00  00 00 00 00  00 00 00 00 
      Offset 0B0:  00 00 00 00  00 00 00 00  00 00 00 00  00 00 00 00 
      Offset 0C0:  00 00 00 00  00 00 00 00  00 00 00 00  00 00 00 00 
      Offset 0D0:  00 00 00 00  00 AA FF 00  00 00 F3 40  27 00 00 00 
      Offset 0E0:  00 00 00 00  FF FF FF FF  FF FF FF FF  04 50 B2 DD 
      Offset 0F0:  00 00 00 00  88 85 80 00  B1 0F 06 08  08 17 1A 20 

    B00 D1F F00:  Intel H81 Chipset - LPC Interface Controller [C2]
                  
      Offset 000:  86 80 5C 8C  07 00 10 02  05 00 01 06  00 00 80 00 
      Offset 010:  00 00 00 00  00 00 00 00  00 00 00 00  00 00 00 00 
      Offset 020:  00 00 00 00  00 00 00 00  00 00 00 00  AA 17 7D 36 
      Offset 030:  00 00 00 00  E0 00 00 00  00 00 00 00  00 00 00 00 
      Offset 040:  01 18 00 00  80 00 00 00  01 1C 00 00  10 00 00 00 
      Offset 050:  F8 00 00 00  00 00 00 00  00 00 00 00  00 00 00 00 
      Offset 060:  80 80 80 80  90 00 00 00  80 80 80 80  F8 F0 00 00 
      Offset 070:  78 F0 78 F0  78 F0 78 F0  78 F0 78 F0  78 F0 78 F0 
      Offset 080:  00 00 00 14  01 0A 3C 00  00 00 00 00  00 00 00 00 
      Offset 090:  00 00 00 00  00 0F 00 00  00 00 00 00  00 00 00 00 
      Offset 0A0:  18 5E 80 60  09 18 06 00  00 46 00 00  00 00 01 80 
      Offset 0B0:  00 00 00 00  00 00 00 00  00 00 00 10  00 00 00 00 
      Offset 0C0:  00 00 00 00  00 00 00 00  00 00 00 00  00 00 00 00 
      Offset 0D0:  33 22 11 00  67 45 00 00  CF FF 00 00  22 00 00 00 
      Offset 0E0:  09 00 0C 10  00 00 00 00  01 01 F1 91  00 00 00 00 
      Offset 0F0:  01 C0 D1 FE  00 00 00 00  B1 0F 06 08  00 00 00 00 

    B00 D1F F02:  Intel Lynx Point PCH - SATA AHCI Controller (Ports 0-5) [C2]
                  
      Offset 000:  86 80 02 8C  07 04 B0 02  05 01 06 01  00 00 00 00 
      Offset 010:  71 F0 00 00  61 F0 00 00  51 F0 00 00  41 F0 00 00 
      Offset 020:  21 F0 00 00  00 60 21 F7  00 00 00 00  AA 17 7D 36 
      Offset 030:  00 00 00 00  80 00 00 00  00 00 00 00  00 02 00 00 
      Offset 040:  00 80 00 80  00 00 00 00  00 00 00 00  00 00 00 00 
      Offset 050:  00 00 00 00  00 00 00 00  00 00 00 00  00 00 00 00 
      Offset 060:  00 00 00 00  00 00 00 00  00 00 00 00  00 00 00 00 
      Offset 070:  01 A8 03 40  08 00 00 00  00 00 00 00  00 00 00 00 
      Offset 080:  05 70 01 00  98 01 E0 FE  00 00 00 00  00 00 00 00 
      Offset 090:  60 0C 33 A3  83 01 00 0C  20 02 5C E0  21 00 00 80 
      Offset 0A0:  A8 00 00 00  00 00 00 00  12 00 10 00  48 00 00 00 
      Offset 0B0:  00 00 00 00  00 00 00 00  00 00 00 00  00 00 00 00 
      Offset 0C0:  00 00 00 00  00 00 00 00  00 00 00 00  00 00 00 00 
      Offset 0D0:  00 00 00 00  00 00 00 00  00 00 00 00  00 00 00 00 
      Offset 0E0:  00 00 00 00  00 00 00 00  00 00 00 00  00 00 00 00 
      Offset 0F0:  00 00 00 00  00 00 00 00  B1 0F 06 08  00 00 00 00 

    B00 D1F F03:  Intel Lynx Point PCH - SMBus Controller [C2]
                  
      Offset 000:  86 80 22 8C  00 04 80 02  05 00 05 0C  00 00 00 00 
      Offset 010:  04 50 21 F7  00 00 00 00  00 00 00 00  00 00 00 00 
      Offset 020:  01 F0 00 00  00 00 00 00  00 00 00 00  AA 17 7D 36 
      Offset 030:  00 00 00 00  00 00 00 00  00 00 00 00  12 03 00 00 
      Offset 040:  10 00 00 00  00 00 00 00  00 00 00 00  00 00 00 00 
      Offset 050:  00 00 00 00  00 00 00 00  00 00 00 00  00 00 00 00 
      Offset 060:  03 04 04 00  00 00 08 08  00 00 00 00  00 00 00 00 
      Offset 070:  00 00 00 00  00 00 00 00  00 00 00 00  00 00 00 00 
      Offset 080:  04 00 00 00  00 00 00 00  00 00 00 00  00 00 00 00 
      Offset 090:  00 00 00 00  00 00 00 00  00 00 00 00  00 00 00 00 
      Offset 0A0:  00 00 00 00  00 00 00 00  00 00 00 00  00 00 00 00 
      Offset 0B0:  00 00 00 00  00 00 00 00  00 00 00 00  00 00 00 00 
      Offset 0C0:  00 00 00 00  00 00 00 00  00 00 00 00  00 00 00 00 
      Offset 0D0:  00 00 00 00  00 00 00 00  00 00 00 00  00 00 00 00 
      Offset 0E0:  00 00 00 00  00 00 00 00  00 00 00 00  00 00 00 00 
      Offset 0F0:  00 00 00 00  00 00 00 00  B1 0F 06 08  00 00 00 00 

    B00 D1F F06:  Intel Lynx Point PCH - Thermal Controller [C2]
                  
      Offset 000:  86 80 24 8C  00 00 10 00  05 00 80 11  00 00 00 00 
      Offset 010:  04 00 00 00  00 00 00 00  00 00 00 00  00 00 00 00 
      Offset 020:  00 00 00 00  00 00 00 00  00 00 00 00  AA 17 7D 36 
      Offset 030:  00 00 00 00  50 00 00 00  00 00 00 00  FF 03 00 00 
      Offset 040:  05 F0 FD F7  00 00 00 00  00 00 00 00  00 00 00 00 
      Offset 050:  01 80 23 00  08 00 00 00  00 00 00 00  00 00 00 00 
      Offset 060:  00 00 00 00  00 00 00 00  00 00 00 00  00 00 00 00 
      Offset 070:  00 00 00 00  00 00 00 00  00 00 00 00  00 00 00 00 
      Offset 080:  05 00 00 00  00 00 00 00  00 00 00 00  00 00 00 00 
      Offset 090:  00 00 00 00  00 00 00 00  00 00 00 00  00 00 00 00 
      Offset 0A0:  00 00 00 00  00 00 00 00  00 00 00 00  00 00 00 00 
      Offset 0B0:  00 00 00 00  00 00 00 00  00 00 00 00  00 00 00 00 
      Offset 0C0:  00 00 00 00  00 00 00 00  00 00 00 00  00 00 00 00 
      Offset 0D0:  00 00 00 00  00 00 00 00  00 00 00 00  00 00 00 00 
      Offset 0E0:  00 00 00 00  00 00 00 00  00 00 00 00  00 00 00 00 
      Offset 0F0:  00 00 00 00  00 00 00 00  B1 0F 06 08  00 00 00 00 

    B01 D00 F00:  MSI N635GT (MS-V292) Video Adapter
                  
      Offset 000:  DE 10 80 12  07 00 10 00  A1 00 00 03  10 00 80 00 
      Offset 010:  00 00 00 F6  0C 00 00 E8  00 00 00 00  0C 00 00 F0 
      Offset 020:  00 00 00 00  01 E0 00 00  00 00 00 00  62 14 22 29 
      Offset 030:  00 00 00 00  60 00 00 00  00 00 00 00  10 01 00 00 
      Offset 040:  62 14 22 29  00 00 00 00  00 00 00 00  00 00 00 00 
      Offset 050:  00 00 00 00  01 00 00 00  CE D6 23 00  00 00 00 00 
      Offset 060:  01 68 03 00  08 00 00 00  05 78 80 00  00 00 00 00 
      Offset 070:  00 00 00 00  00 00 00 00  10 00 12 00  E1 8D 2C 01 
      Offset 080:  10 21 00 00  82 3C 45 00  41 01 82 10  00 00 00 00 
      Offset 090:  00 00 00 00  00 00 00 00  00 00 00 00  13 00 00 00 
      Offset 0A0:  00 00 00 00  06 00 00 00  02 00 01 00  00 00 00 00 
      Offset 0B0:  00 00 00 00  09 00 14 01  00 00 00 00  00 00 00 00 
      Offset 0C0:  00 00 00 00  00 00 00 00  00 00 00 00  00 00 00 00 
      Offset 0D0:  00 00 00 00  00 00 00 00  00 00 00 00  00 00 00 00 
      Offset 0E0:  00 00 00 00  00 00 00 00  00 00 00 00  00 00 00 00 
      Offset 0F0:  00 00 00 00  00 00 00 00  00 00 00 00  00 00 00 00 

    B01 D00 F01:  nVIDIA GK208 - High Definition Audio Controller
                  
      Offset 000:  DE 10 0F 0E  06 00 10 00  A1 00 03 04  10 00 80 00 
      Offset 010:  00 C0 0F F7  00 00 00 00  00 00 00 00  00 00 00 00 
      Offset 020:  00 00 00 00  00 00 00 00  00 00 00 00  62 14 22 29 
      Offset 030:  00 00 00 00  60 00 00 00  00 00 00 00  11 02 00 00 
      Offset 040:  62 14 22 29  00 00 00 00  00 00 00 00  00 00 00 00 
      Offset 050:  00 00 00 00  00 00 00 00  CE D6 23 00  00 00 00 00 
      Offset 060:  01 68 03 00  08 00 00 00  05 78 80 00  00 00 00 00 
      Offset 070:  00 00 00 00  00 00 00 00  10 00 02 00  E1 8D 2C 01 
      Offset 080:  00 21 00 00  82 3C 45 00  03 01 82 10  00 00 00 00 
      Offset 090:  00 00 00 00  00 00 00 00  00 00 00 00  13 00 00 00 
      Offset 0A0:  00 00 00 00  06 00 00 00  00 00 01 00  00 00 00 00 
      Offset 0B0:  00 00 00 00  00 00 00 00  00 00 00 00  00 00 00 00 
      Offset 0C0:  00 00 00 00  00 00 00 00  00 00 00 00  00 00 00 00 
      Offset 0D0:  00 00 00 00  00 00 00 00  00 00 00 00  00 00 00 00 
      Offset 0E0:  00 00 00 00  00 00 00 00  00 00 00 00  00 00 00 00 
      Offset 0F0:  00 00 00 00  00 00 00 00  00 00 00 00  00 00 00 00 

    B03 D00 F00:  Realtek RTL8168/8111 PCI-E Gigabit Ethernet Adapter
                  
      Offset 000:  EC 10 68 81  07 04 10 00  0C 00 00 02  10 00 00 00 
      Offset 010:  01 D0 00 00  00 00 00 00  04 00 10 F7  00 00 00 00 
      Offset 020:  0C 00 10 F2  00 00 00 00  00 00 00 00  AA 17 7D 36 
      Offset 030:  00 00 00 00  40 00 00 00  00 00 00 00  00 01 00 00 
      Offset 040:  01 50 C3 FF  08 00 00 00  00 00 00 00  00 00 00 00 
      Offset 050:  05 70 80 00  00 00 00 00  00 00 00 00  00 00 00 00 
      Offset 060:  00 00 00 00  00 00 00 00  00 00 00 00  00 00 00 00 
      Offset 070:  10 B0 02 02  C0 8C 90 05  07 20 10 00  11 7C 47 00 
      Offset 080:  40 00 11 10  00 00 00 00  00 00 00 00  00 00 00 00 
      Offset 090:  00 00 00 00  1F 08 0C 00  10 04 00 00  02 00 00 00 
      Offset 0A0:  00 00 00 00  00 00 00 00  00 00 00 00  00 00 00 00 
      Offset 0B0:  11 D0 03 80  04 00 00 00  04 08 00 00  00 00 00 00 
      Offset 0C0:  00 00 00 00  00 00 00 00  00 00 00 00  00 00 00 00 
      Offset 0D0:  03 00 FC 80  FF FF FF FF  00 00 00 00  00 00 00 00 
      Offset 0E0:  00 00 00 00  00 00 00 00  00 00 00 00  00 00 00 00 
      Offset 0F0:  00 00 00 00  00 00 00 00  00 00 00 00  00 00 00 00 

    PCI-8086-0C00:  Intel SNB/IVB/HSW/CRW/BDW/SKL/KBL/CFL/WHL/CNL/CML/ICL/RKL/TGL/JSL MCHBAR
                  
      Offset 4000:  C6 50 44 10  03 41 22 82  45 55 AB 0A  CA 64 29 05
      Offset 4010:  08 00 00 00  C6 14 00 00  00 00 00 00  00 00 00 00
      Offset 4020:  00 00 10 00  20 20 20 20  00 00 0E 00  00 00 00 00
      Offset 4030:  00 00 00 00  00 00 00 00  00 00 00 00  00 00 00 00
      Offset 4040:  49 C0 00 00  00 00 00 00  56 34 12 00  EF CD AB 00
      Offset 4050:  43 65 87 00  56 34 12 00  EF CD AB 00  43 65 87 00
      Offset 4060:  00 00 00 00  00 00 00 00  00 00 00 00  00 00 00 00
      Offset 4070:  00 00 00 00  00 00 00 00  00 01 01 01  00 00 00 00
      Offset 4080:  00 00 00 00  00 00 00 00  00 00 00 00  00 00 00 00

    PCI-8086-0C00:  Intel SNB/IVB/HSW/CRW/BDW/SKL/KBL/CFL/WHL/CNL/CML/ICL/RKL/TGL/JSL MCHBAR
                  
      Offset 4200:  00 00 3F 00  00 00 00 00  00 00 00 00  00 00 00 00
      Offset 4210:  00 00 00 00  00 00 00 00  00 00 00 00  00 00 00 00
      Offset 4220:  00 00 00 00  00 00 00 00  00 00 00 00  00 00 00 00
      Offset 4230:  00 00 00 00  00 00 00 00  00 00 00 00  00 00 00 00
      Offset 4240:  00 00 00 00  00 00 00 00  00 00 00 00  00 00 00 00
      Offset 4250:  00 00 00 00  00 00 00 00  00 00 00 00  00 00 00 00
      Offset 4260:  00 00 00 00  00 00 00 00  00 00 00 00  00 00 00 00
      Offset 4270:  00 00 00 00  00 00 00 00  00 00 00 00  00 00 00 00
      Offset 4280:  00 00 00 00  00 00 00 00  00 00 00 00  00 00 00 00
      Offset 4290:  80 40 00 00  0F 98 00 00  04 10 B4 46  00 00 00 00
      Offset 42A0:  00 00 00 00  00 B2 00 01  00 00 00 00  00 00 00 00

    PCI-8086-0C00:  Intel SNB/IVB/HSW/CRW/BDW/SKL/KBL/CFL/WHL/CNL/CML/ICL/RKL/TGL/JSL MCHBAR
                  
      Offset 4400:  6B 71 86 15  84 41 33 08  D4 10 EF B0  54 DD 5A 0B
      Offset 4410:  07 00 00 00  0B D5 00 00  00 00 00 00  00 00 00 00
      Offset 4420:  00 00 10 00  2A 2A 00 00  33 00 15 00  00 00 00 00
      Offset 4430:  00 00 00 00  00 00 00 00  00 00 00 00  00 00 00 00
      Offset 4440:  49 C0 00 00  00 00 00 00  A1 0C A1 00  08 0D EF 00
      Offset 4450:  1E 0A AD 00  A1 0C A1 00  08 0D EF 00  1E 0A AD 00
      Offset 4460:  A1 0C A1 00  08 0D EF 00  1E 0A AD 00  A1 0C A1 00
      Offset 4470:  08 0D EF 00  1E 0A AD 00  02 01 01 0A  00 00 00 00
      Offset 4480:  00 00 00 00  00 00 00 00  00 00 00 00  00 00 00 00

    PCI-8086-0C00:  Intel SNB/IVB/HSW/CRW/BDW/SKL/KBL/CFL/WHL/CNL/CML/ICL/RKL/TGL/JSL MCHBAR
                  
      Offset 4600:  00 00 3F 00  00 00 00 00  00 00 00 00  00 00 00 00
      Offset 4610:  00 00 00 00  00 00 00 00  00 00 00 00  00 00 00 00
      Offset 4620:  00 00 00 00  00 00 00 00  00 00 00 00  00 00 00 00
      Offset 4630:  00 00 00 00  00 00 00 00  00 00 00 00  00 00 00 00
      Offset 4640:  00 00 00 00  00 00 00 00  00 00 00 00  00 00 00 00
      Offset 4650:  00 00 00 00  00 00 00 00  00 00 00 00  00 00 00 00
      Offset 4660:  00 00 00 00  00 00 00 00  00 00 00 00  00 00 00 00
      Offset 4670:  00 00 00 00  00 00 00 00  00 00 00 00  00 00 00 00
      Offset 4680:  00 00 00 00  00 00 00 00  00 00 00 00  00 00 00 00
      Offset 4690:  80 40 00 00  FF 98 00 00  60 18 D0 6C  58 42 00 00
      Offset 46A0:  03 00 00 00  00 82 00 41  00 00 00 00  00 00 00 00

    PCI-8086-0C00:  Intel SNB/IVB/HSW/CRW/BDW/SKL/KBL/CFL/WHL/CNL/CML/ICL/RKL/TGL/JSL MCHBAR
                  
      Offset 4800:  00 00 00 00  00 00 03 00  00 00 00 08  00 00 00 08
      Offset 4810:  00 00 00 08  00 00 00 08  00 00 00 08  00 00 00 08

    PCI-8086-0C00:  Intel SNB/IVB/HSW/CRW/BDW/SKL/KBL/CFL/WHL/CNL/CML/ICL/RKL/TGL/JSL MCHBAR
                  
      Offset 4A80:  00 00 00 00  00 00 00 00  00 00 00 00  00 00 00 00
      Offset 4A90:  00 00 00 00  00 00 00 00  00 00 00 00  00 00 00 00

    PCI-8086-0C00:  Intel SNB/IVB/HSW/CRW/BDW/SKL/KBL/CFL/WHL/CNL/CML/ICL/RKL/TGL/JSL MCHBAR
                  
      Offset 5000:  21 00 00 00  00 00 60 00  20 00 62 00  00 00 60 00
      Offset 5010:  00 00 00 00  00 00 00 00  00 00 00 00  00 00 00 00

    PCI-8086-0C00:  Intel SNB/IVB/HSW/CRW/BDW/SKL/KBL/CFL/WHL/CNL/CML/ICL/RKL/TGL/JSL MCHBAR
                  
      Offset 5880:  60 00 00 00  04 00 00 00  00 11 00 00  00 00 00 00
      Offset 5890:  FF FF 00 00  FF FF 00 00  FF FF 00 00  FF FF 00 00
      Offset 58A0:  00 00 00 00  00 00 00 00  DB 2A 00 00  00 00 00 00
      Offset 58B0:  00 00 00 00  00 00 00 00  00 00 00 00  7F 00 00 00
      Offset 58C0:  00 00 00 00  00 00 00 00  00 00 00 00  00 00 00 00
      Offset 58D0:  FF FF 00 00  FF FF 00 00  FF FF 00 00  FF FF 00 00
      Offset 58E0:  00 00 00 00  DE 00 54 00  EC E6 73 02  00 00 00 00
      Offset 58F0:  00 00 00 00  00 00 00 00  00 00 13 00  00 00 20 31
      Offset 5900:  00 00 00 00  00 00 00 0D  00 00 00 00  00 00 00 00
      Offset 5910:  00 00 00 00  00 00 00 00  00 00 00 00  00 00 00 00
      Offset 5920:  00 00 00 00  10 00 00 00  BA 3B 23 09  00 00 00 00
      Offset 5930:  A0 02 00 00  00 00 00 00  03 0E 0A 00  D7 6C EC 0F
      Offset 5940:  00 00 00 00  00 00 00 00  00 00 00 00  00 00 00 00
      Offset 5950:  00 00 00 00  00 00 04 00  00 22 01 F3  28 08 08 00
      Offset 5960:  00 00 00 00  0D 12 0F 2A  D7 8A 07 C0  F0 CE A5 31
      Offset 5970:  00 00 00 00  00 00 00 00  25 00 00 00  25 00 00 00
      Offset 5980:  23 00 00 00  47 46 A4 AB  00 00 00 00  00 00 00 00
      Offset 5990:  FF 00 00 00  FF 00 00 00  18 07 04 00  00 14 64 00
      Offset 59A0:  00 00 00 00  00 00 00 00  00 00 00 00  00 00 00 00
      Offset 59B0:  F8 02 00 00  14 14 10 00  00 00 00 00  00 00 00 00
      Offset 59C0:  00 00 41 88  00 00 00 00  00 00 00 00  00 00 00 00

    PCI-8086-0C00:  Intel SNB/IVB/HSW/CRW/BDW/SKL/KBL/CFL/WHL/CNL/CML/ICL/RKL/TGL/JSL MCHBAR
                  
      Offset 5E00:  06 00 00 00  06 00 00 00  00 00 00 00  00 00 00 00
      Offset 5E10:  00 00 00 00  00 00 00 00  00 00 00 00  00 00 00 00

    PCI-8086-8C24:  Intel 8/9-series PCH TBAR
                  
      Offset 00:  B5 00 00 00  80 00 00 00  81 00 01 00  80 00 00 00
      Offset 10:  54 01 00 00  00 00 00 00  00 00 00 00  00 00 00 00
      Offset 20:  00 00 00 00  00 00 00 00  00 00 00 00  00 00 00 00
      Offset 30:  00 00 00 00  00 00 00 00  00 00 00 00  00 00 00 00
      Offset 40:  3C 09 85 B4  00 00 00 00  00 00 00 00  00 00 00 00
      Offset 50:  00 00 00 00  00 00 00 00  00 00 00 00  00 00 00 00
      Offset 60:  00 00 01 00  00 00 00 00  00 00 00 00  00 00 00 00
      Offset 70:  00 00 00 00  00 00 00 00  00 00 00 00  00 00 00 00
      Offset 80:  01 00 00 00


--------[ Debug - Video BIOS ]------------------------------------------------------------------------------------------

    C000:0000  ................................................................
    C000:0040  ................................................................
    C000:0080  ................................................................
    C000:00C0  ................................................................
    C000:0100  ................................................................
    C000:0140  ................................................................
    C000:0180  ................................................................
    C000:01C0  ................................................................
    C000:0200  ................................................................
    C000:0240  ................................................................
    C000:0280  ................................................................
    C000:02C0  ................................................................
    C000:0300  ................................................................
    C000:0340  ................................................................
    C000:0380  ................................................................
    C000:03C0  ................................................................


--------[ Debug - Unknown ]---------------------------------------------------------------------------------------------

    BIOS            Unknown
    Optical         MATSHITA DVD-RAM SW830
    SPD             No SPD module found! (BusCount = 0)


------------------------------------------------------------------------------------------------------------------------

The names of actual companies and products mentioned herein may be the trademarks of their respective owners.
