--------[ AIDA64 Extreme ]----------------------------------------------------------------------------------------------

    Версия                                            AIDA64 v6.60.5900/ru
    Тестовый модуль                                   4.5.865.8-x64
    Домашняя страница                                 http://www.aida64.com/
    Тип отчёта                                        Мастер отчётов
    Компьютер                                         DESKTOP-3RV1MEH
    Генератор                                         vlads
    Операционная система                              Microsoft Windows 10 Home Single Language 10.0.19043.1526 (Win10 21H1 May 2021 Update)
    Дата                                              2022-02-24
    Время                                             19:53


--------[ Сеть Windows ]------------------------------------------------------------------------------------------------

  [ Realtek PCIe GbE Family Controller ]

    Свойства сетевого адаптера:
      Сетевой адаптер                                   Realtek PCIe GbE Family Controller
      Тип интерфейса                                    Ethernet
      Аппаратный адрес                                  74-27-EA-EC-89-03
      Соединение                                        Ethernet
      Скорость соединения                               100 Mbps
      MTU                                               1500 байт
      DHCP-аренда получена                              24.02.2022 19:18:49
      DHCP-аренда истекает                              25.02.2022 19:18:49
      Получено байт                                     116987546 (111.6 МБ)
      Отправлено байт                                   25194850 (24.0 МБ)

    Адреса сетевого адаптера:
      IP / маска подсети                                192.168.1.142 / 255.255.255.0
      Шлюз                                              192.168.1.1
      DHCP                                              192.168.1.1
      DNS                                               192.168.1.1

    Производитель сетевого адаптера:
      Фирма                                             Realtek Semiconductor Corp.
      Информация о продукте                             https://www.realtek.com/products
      Загрузка драйверов                                https://www.realtek.com/downloads
      Обновление драйверов                              http://www.aida64.com/goto/?p=drvupdates

  [ VirtualBox Host-Only Ethernet Adapter ]

    Свойства сетевого адаптера:
      Сетевой адаптер                                   VirtualBox Host-Only Ethernet Adapter
      Тип интерфейса                                    Ethernet
      Аппаратный адрес                                  0A-00-27-00-00-07
      Соединение                                        VirtualBox Host-Only Network
      Скорость соединения                               1 Gbps
      MTU                                               1500 байт
      Получено байт                                     0
      Отправлено байт                                   0

    Адреса сетевого адаптера:
      IP / маска подсети                                192.168.56.1 / 255.255.255.0

    Производитель сетевого адаптера:
      Фирма                                             Oracle Corporation
      Информация о продукте                             http://www.virtualbox.org
      Загрузка драйверов                                http://www.virtualbox.org
      Обновление драйверов                              http://www.aida64.com/goto/?p=drvupdates


--------[ Сеть PCI / PnP ]----------------------------------------------------------------------------------------------

    Realtek RTL8168/8111 PCI-E Gigabit Ethernet Adapter (PHY: Realtek RTL8111)        PCI


--------[ Интернет ]----------------------------------------------------------------------------------------------------

    Установки Интернета:
      Домашняя страница                                 https://www.yandex.ru/?win=519&clid=2255394-225
      Страница поиска                                   http://go.microsoft.com/fwlink/?LinkId=54896
      Локальная страница                                %11%\blank.htm
      Папка для загружаемых файлов                      

    Текущий прокси:
      Статус прокси                                     Запрещено

    LAN-прокси:
      Статус прокси                                     Запрещено


--------[ Маршруты ]----------------------------------------------------------------------------------------------------

    Активный              0.0.0.0          0.0.0.0      192.168.1.1  35   192.168.1.142 (Realtek PCIe GbE Family Controller)
    Активный            127.0.0.0        255.0.0.0        127.0.0.1  331  127.0.0.1 (Software Loopback Interface 1)
    Активный            127.0.0.1  255.255.255.255        127.0.0.1  331  127.0.0.1 (Software Loopback Interface 1)
    Активный      127.255.255.255  255.255.255.255        127.0.0.1  331  127.0.0.1 (Software Loopback Interface 1)
    Активный          192.168.1.0    255.255.255.0    192.168.1.142  291  192.168.1.142 (Realtek PCIe GbE Family Controller)
    Активный        192.168.1.142  255.255.255.255    192.168.1.142  291  192.168.1.142 (Realtek PCIe GbE Family Controller)
    Активный        192.168.1.255  255.255.255.255    192.168.1.142  291  192.168.1.142 (Realtek PCIe GbE Family Controller)
    Активный         192.168.56.0    255.255.255.0     192.168.56.1  281  192.168.56.1 (VirtualBox Host-Only Ethernet Adapter)
    Активный         192.168.56.1  255.255.255.255     192.168.56.1  281  192.168.56.1 (VirtualBox Host-Only Ethernet Adapter)
    Активный       192.168.56.255  255.255.255.255     192.168.56.1  281  192.168.56.1 (VirtualBox Host-Only Ethernet Adapter)
    Активный            224.0.0.0        240.0.0.0        127.0.0.1  331  127.0.0.1 (Software Loopback Interface 1)
    Активный            224.0.0.0        240.0.0.0     192.168.56.1  281  192.168.56.1 (VirtualBox Host-Only Ethernet Adapter)
    Активный            224.0.0.0        240.0.0.0    192.168.1.142  291  192.168.1.142 (Realtek PCIe GbE Family Controller)
    Активный      255.255.255.255  255.255.255.255        127.0.0.1  331  127.0.0.1 (Software Loopback Interface 1)
    Активный      255.255.255.255  255.255.255.255     192.168.56.1  281  192.168.56.1 (VirtualBox Host-Only Ethernet Adapter)
    Активный      255.255.255.255  255.255.255.255    192.168.1.142  291  192.168.1.142 (Realtek PCIe GbE Family Controller)


--------[ IE Cookie ]---------------------------------------------------------------------------------------------------

    2022-02-24 18:25:55  vlads@win-rar.com/


--------[ История браузера ]--------------------------------------------------------------------------------------------

    2022-02-18 14:59:32  vlads@file:///C:/Users/vlads/OneDrive/РР·РѕР±СЂР°Р¶РµРЅРёСЏ/РЎРЅРёРјРєРё%20СЌРєСЂР°РЅР°/РЎРЅРёРјРѕРє%20СЌРєСЂР°РЅР°%20(197).png
    2022-02-18 15:01:13  vlads@file:///C:/Users/vlads/OneDrive/РР·РѕР±СЂР°Р¶РµРЅРёСЏ/РЎРЅРёРјРєРё%20СЌРєСЂР°РЅР°/РЎРЅРёРјРѕРє%20СЌРєСЂР°РЅР°%20(199).png
    2022-02-18 15:01:22  vlads@file:///C:/Users/vlads/OneDrive/РР·РѕР±СЂР°Р¶РµРЅРёСЏ/РЎРЅРёРјРєРё%20СЌРєСЂР°РЅР°/РЎРЅРёРјРѕРє%20СЌРєСЂР°РЅР°%20(200).png
    2022-02-18 15:01:29  vlads@file:///C:/Users/vlads/OneDrive/РР·РѕР±СЂР°Р¶РµРЅРёСЏ/РЎРЅРёРјРєРё%20СЌРєСЂР°РЅР°/РЎРЅРёРјРѕРє%20СЌРєСЂР°РЅР°%20(201).png
    2022-02-18 15:55:03  vlads@file:///C:/Users/vlads/OneDrive/Р Р°Р±РѕС‡РёР№%20СЃС‚РѕР»/РёР·РѕР±СЂР°Р¶РµРЅРёРµ_viber_2022-02-18_15-52-27-182.jpg
    2022-02-21 09:48:33  vlads@ms-gamingoverlay://kglcheck/
    2022-02-21 09:48:34  vlads@ms-gamingoverlay:///
    2022-02-21 13:38:33  vlads@file:///C:/Users/vlads/OneDrive/Р Р°Р±РѕС‡РёР№%20СЃС‚РѕР»/LAB1.rar
    2022-02-21 13:46:10  vlads@file:///C:/Users/vlads/OneDrive/Р Р°Р±РѕС‡РёР№%20СЃС‚РѕР»/fact.asm
    2022-02-21 13:58:55  vlads@file:///C:/Users/vlads/OneDrive/Р Р°Р±РѕС‡РёР№%20СЃС‚РѕР»/СЂРµРєР»Р°РјР°.png
    2022-02-21 14:01:59  vlads@file:///C:/Users/vlads/OneDrive/Р Р°Р±РѕС‡РёР№%20СЃС‚РѕР»/int.rar
    2022-02-21 14:14:04  vlads@file:///C:/Users/vlads/OneDrive/Р Р°Р±РѕС‡РёР№%20СЃС‚РѕР»/tsr.rar
    2022-02-21 14:32:01  vlads@file:///C:/Users/vlads/OneDrive/Р Р°Р±РѕС‡РёР№%20СЃС‚РѕР»/small.rar
    2022-02-21 14:32:31  vlads@file:///C:/Users/vlads/OneDrive/Р Р°Р±РѕС‡РёР№%20СЃС‚РѕР»/flat.rar
    2022-02-22 09:20:56  vlads@file:///D:/Download/Р—Р°РґР°РЅРёСЏ%20Рє%20РєСѓСЂСЃ_РїСЂРѕРµРєС‚РёСЂ_РџРњРћРЎРџРЎ_22.rtf
    2022-02-22 11:05:19  vlads@file:///D:/Download/Zadania_k_kurs_proektir_PMOSPS_22.rtf
    2022-02-22 13:13:07  vlads@file:///D:/Р’Р»Р°Рґ/РЈР§Р•Р‘Рђ/РџРѕР»РёС‚РµС…/РЎРџРћ/РљСѓСЂСЃР°С‡%20РїРѕ%20РЎРџРћ.docx
    2022-02-22 13:13:27  vlads@file:///D:/Р’Р»Р°Рґ/РЈР§Р•Р‘Рђ/РџРѕР»РёС‚РµС…/РЎРџРћ/Answer.docx
    2022-02-22 13:13:33  vlads@file:///D:/Р’Р»Р°Рґ/РЈР§Р•Р‘Рђ/РџРѕР»РёС‚РµС…/РЎРџРћ/5fan_ru_РЈРїСЂР°РІР»РµРЅРёРµ%20РїСЂРѕС†РµСЃСЃР°РјРё%20РІ%20Windows.docx
    2022-02-22 13:13:51  vlads@file:///D:/Р’Р»Р°Рґ/РЈР§Р•Р‘Рђ/РџРѕР»РёС‚РµС…/РџРћР’РЎ/6%20СЃРµРјРµСЃС‚СЂ/lab1.jpg
    2022-02-22 13:14:06  vlads@file:///D:/Р’Р»Р°Рґ/РЈР§Р•Р‘Рђ/РџРѕР»РёС‚РµС…/РџРћР’РЎ/6%20СЃРµРјРµСЃС‚СЂ/lab1_1.jpg
    2022-02-22 13:15:18  vlads@file:///D:/Р’Р»Р°Рґ/РЈР§Р•Р‘Рђ/РЎРµРјРµСЃС‚СЂ%203.2
    2022-02-22 13:15:18  vlads@file:///D:/Р’Р»Р°Рґ/РЈР§Р•Р‘Рђ/РЎРµРјРµСЃС‚СЂ%203.2/РџРњ
    2022-02-22 13:16:04  vlads@file:///D:/Р’Р»Р°Рґ/РЈР§Р•Р‘Рђ/РЎРµРјРµСЃС‚СЂ%203.2/РџРњРћРЎРџРЎ
    2022-02-22 13:16:04  vlads@file:///D:/Р’Р»Р°Рґ/РЈР§Р•Р‘Рђ/РЎРµРјРµСЃС‚СЂ%203.2/РџРњРћРЎРџРЎ/Р›Р°Р±%201
    2022-02-22 13:18:53  vlads@file:///D:/Р’Р»Р°Рґ/РЈР§Р•Р‘Рђ/РЎРµРјРµСЃС‚СЂ%203.2/РџРњРћРЎРџРЎ/Р›Р°Р±%201/LAB1.rar
    2022-02-22 13:18:55  vlads@https://notifier.win-rar.com/?language=Russian&source=wrr&landingpage=firstexpired&version=602&architecture=64
    2022-02-22 13:19:40  vlads@file:///D:/Р’Р»Р°Рґ/РЈР§Р•Р‘Рђ/РЎРµРјРµСЃС‚СЂ%203.1/РђСЃСЃРµРјР±Р»РµСЂ/Р›Р 4/ASM_РЎР°РїРѕР¶РЅРёРєРѕРІ_Р’.Рћ._19-Р’-1_Р›Р 4.docx
    2022-02-22 13:30:27  vlads@file:///D:/Р’Р»Р°Рґ/РЈР§Р•Р‘Рђ/РЎРµРјРµСЃС‚СЂ%203.2/РџРњРћРЎРџРЎ/Р›Р°Р±%201/fact.asm
    2022-02-22 13:32:13  vlads@file:///D:/Р’Р»Р°Рґ/РЈР§Р•Р‘Рђ/РЎРµРјРµСЃС‚СЂ%203.2/РџРњРћРЎРџРЎ/Р›Р°Р±%201/k_LAB1_2.doc
    2022-02-22 13:37:59  vlads@file:///D:/Р’Р»Р°Рґ/РЈР§Р•Р‘Рђ/РџРѕР»РёС‚РµС…/РЎРµС‚Рё/5%20СЃРµРјРµСЃС‚СЂ/Р›Р°Р±РѕСЂР°С‚РѕСЂРЅР°СЏ%20СЂР°Р±РѕС‚Р°%20в„–1/Nos_lab1.doc
    2022-02-22 13:38:51  vlads@file:///D:/Р’Р»Р°Рґ/РЈР§Р•Р‘Рђ/РџРѕР»РёС‚РµС…/РЎРµС‚Рё/5%20СЃРµРјРµСЃС‚СЂ/Р›Р°Р±РѕСЂР°С‚РѕСЂРЅР°СЏ%20СЂР°Р±РѕС‚Р°%20в„–2/С‚РёС‚СѓР»СЊРЅРёРє.pdf
    2022-02-22 13:38:59  vlads@file:///D:/Р’Р»Р°Рґ/РЈР§Р•Р‘Рђ/РџРѕР»РёС‚РµС…/РЎРµС‚Рё/5%20СЃРµРјРµСЃС‚СЂ/Р›Р°Р±РѕСЂР°С‚РѕСЂРЅР°СЏ%20СЂР°Р±РѕС‚Р°%20в„–2/2labaOtchet.pdf
    2022-02-22 13:39:40  vlads@file:///D:/Р’Р»Р°Рґ/РЈР§Р•Р‘Рђ/РџРѕР»РёС‚РµС…/РЎРµС‚Рё/6%20СЃРµРјРµСЃС‚СЂ/lab1.docx
    2022-02-22 13:40:28  vlads@file:///D:/Р’Р»Р°Рґ/РЈР§Р•Р‘Рђ/РџРѕР»РёС‚РµС…/РћСЂРіР°РЅРёР·Р°С†РёСЏ%20Р­Р’Рњ/РљСѓСЂСЃР°С‡%20РѕСЂРіР°РЅРёР·Р°С†РёСЏ%20Р­Р’Рњ.docx
    2022-02-22 13:42:20  vlads@file:///D:/Р’Р»Р°Рґ/РЈР§Р•Р‘Рђ/РџРѕР»РёС‚РµС…/РџРћР’РЎ/6%20СЃРµРјРµСЃС‚СЂ/lab3.docx
    2022-02-22 16:25:05  vlads@file:///D:/Р’Р»Р°Рґ/РЈР§Р•Р‘Рђ/РЎРµРјРµСЃС‚СЂ%203.1/РђСЃСЃРµРјР±Р»РµСЂ/lab3.asm
    2022-02-22 16:44:04  vlads@file:///D:/TASM/FACT.LST
    2022-02-22 16:45:47  vlads@file:///C:/Users/vlads/OneDrive/РР·РѕР±СЂР°Р¶РµРЅРёСЏ/РЎРЅРёРјРєРё%20СЌРєСЂР°РЅР°/РЎРЅРёРјРѕРє%20СЌРєСЂР°РЅР°%20(202).png
    2022-02-22 16:57:36  vlads@file:///C:/Users/vlads/OneDrive/РР·РѕР±СЂР°Р¶РµРЅРёСЏ/РЎРЅРёРјРєРё%20СЌРєСЂР°РЅР°/РЎРЅРёРјРѕРє%20СЌРєСЂР°РЅР°%20(204).png
    2022-02-22 17:05:05  vlads@file:///C:/Users/vlads/OneDrive/РР·РѕР±СЂР°Р¶РµРЅРёСЏ/РЎРЅРёРјРєРё%20СЌРєСЂР°РЅР°/РЎРЅРёРјРѕРє%20СЌРєСЂР°РЅР°%20(206).png
    2022-02-22 17:11:54  vlads@file:///C:/Users/vlads/OneDrive/РР·РѕР±СЂР°Р¶РµРЅРёСЏ/РЎРЅРёРјРєРё%20СЌРєСЂР°РЅР°/РЎРЅРёРјРѕРє%20СЌРєСЂР°РЅР°%20(208).png
    2022-02-22 18:08:50  vlads@file:///D:/Р’Р»Р°Рґ/РЈР§Р•Р‘Рђ/РЎРµРјРµСЃС‚СЂ%203.2/РџРњРћРЎРџРЎ/Р›Р°Р±%201/factorial.drawio
    2022-02-22 18:43:56  vlads@file:///D:/Р’Р»Р°Рґ/РЈР§Р•Р‘Рђ/РЎРµРјРµСЃС‚СЂ%203.2/РџРњРћРЎРџРЎ/Р›Р°Р±%201/РџРёРњРћРЎРџРЎ.docx
    2022-02-22 18:43:59  vlads@file:///D:/Р’Р»Р°Рґ/РЈР§Р•Р‘Рђ/РЎРµРјРµСЃС‚СЂ%203.2/РџРњРћРЎРџРЎ/Р›Р°Р±%201/k_LAB1_1.doc
    2022-02-22 19:11:05  vlads@file:///C:/Users/vlads/OneDrive/Р Р°Р±РѕС‡РёР№%20СЃС‚РѕР»/Р›РёСЃС‚%20Microsoft%20Excel.xlsx
    2022-02-24 07:31:50  vlads@file:///D:/TASM/fact.asm
    2022-02-24 07:52:44  vlads@file:///D:/Р’Р»Р°Рґ/РЈР§Р•Р‘Рђ/РЎРµРјРµСЃС‚СЂ%203.2/РџРњРћРЎРџРЎ/Р›Р°Р±%201/LAB1_Р—РђР”РђРќРР•.doc
    2022-02-24 08:52:56  vlads@file:///D:/Download/Р—Р°РґР°РЅРёСЏ%20Рє%20РєСѓСЂСЃ_РїСЂРѕРµРєС‚РёСЂ_РџРњРћРЎРџРЎ_22%20(1).rtf
    2022-02-24 11:10:34  vlads@file:///C:/Users/vlads/OneDrive/Р”РѕРєСѓРјРµРЅС‚С‹/e-puck/controllers/my_controller/my_controller.py
    2022-02-24 11:24:06  vlads@file:///C:/Users/vlads/OneDrive/Р”РѕРєСѓРјРµРЅС‚С‹/e-puck/worlds/e-puck.wbt
    2022-02-24 12:19:15  vlads@file:///D:/Download/Telegram%20Desktop/Р»СЂ_РїРѕ.docx
    2022-02-24 12:19:38  vlads@file:///C:/Users/vlads/OneDrive/Р”РѕРєСѓРјРµРЅС‚С‹/surveyor/worlds/srv-1.wbt
    2022-02-24 12:21:47  vlads@file:///D:/Р’Р»Р°Рґ/РЈР§Р•Р‘Рђ/РўР°Р±Р»РёС‡РёС‡РєР°%20СѓСЃРїРµРІР°РµРјРѕСЃС‚Рё.xlsx
    2022-02-24 15:57:50  vlads@file:///D:/Download/Lab1_net.docx
    2022-02-24 16:02:01  vlads@file:///D:/Р’Р»Р°Рґ/РЈР§Р•Р‘Рђ/РџРѕР»РёС‚РµС…/РЎРµС‚Рё/РћС‚РІРµС‚С‹%20Рє%20СЌРєР·Р°РјРµРЅСѓ%20РїРѕ%20РЎР­Р’Рњ.pdf
    2022-02-24 16:02:37  vlads@file:///C:/Users/vlads/Videos/2022-02-24%2015-33-53.mkv
    2022-02-24 16:05:54  vlads@file:///D:/Download/1Р»Р°Р±Р°.docx
    2022-02-24 18:10:30  vlads@file:///D:/Р’Р»Р°Рґ/РЈР§Р•Р‘Рђ/РџРѕР»РёС‚РµС…/РћСЂРіР°РЅРёР·Р°С†РёСЏ%20Р­Р’Рњ/Р›Р°Р±РѕСЂР°С‚РѕСЂРЅР°СЏ%20СЂР°Р±РѕС‚Р°%20в„–1.docx
    2022-02-24 18:24:49  vlads@file:///C:/Users/vlads/AppData/Local/Temp/mediaget-installer-tmp/preloader.html
    2022-02-24 18:24:51  vlads@file:///C:/Users/vlads/AppData/Local/Temp/mediaget-installer-tmp/index.html
    2022-02-24 18:25:10  vlads@file:///D:/Download/aida64extreme6_key_rus.rar
    2022-02-24 18:25:55  vlads@https://notifier.win-rar.com/?language=Russian&source=wrr&landingpage=expired&version=602&architecture=64
    2022-02-24 18:26:13  vlads@file:///C:/aida64extreme6_key_rus/РџРђР РћР›Р¬%20РќРђ%20РђР РҐРР’!!!.txt
    2022-02-24 18:26:17  vlads@file:///C:/aida64extreme6_key_rus/AIDA64%206.60.5900.rar
    2022-02-24 18:35:40  vlads@file:///C:/Users/vlads/OneDrive/Р Р°Р±РѕС‡РёР№%20СЃС‚РѕР»/Р§Рѕ%20С‚Р°Рј%20РІРЅСѓС‚СЂРё
    2022-02-24 18:59:39  vlads@file:///D:/Р’Р»Р°Рґ/РЈР§Р•Р‘Рђ/РџРѕР»РёС‚РµС…/РћСЂРіР°РЅРёР·Р°С†РёСЏ%20Р­Р’Рњ/Р›Р°Р±РѕСЂР°С‚РѕСЂРЅР°СЏ%20СЂР°Р±РѕС‚Р°%20в„–2.docx
    2022-02-24 19:30:04  vlads@file:///D:/Download/РР РРў%203%20РєСѓСЂСЃ.xlsx
    2022-02-24 19:37:28  vlads@file:///C:/Users/vlads/AppData/Local/Temp/rpt-1.txt
    2022-02-24 19:39:53  vlads@file:///C:/Users/vlads/OneDrive/Р Р°Р±РѕС‡РёР№%20СЃС‚РѕР»/Р§Рѕ%20С‚Р°Рј%20РІРЅСѓС‚СЂРё.txt
    2022-02-24 19:39:55  vlads@file:///C:/Users/vlads/OneDrive/РР·РѕР±СЂР°Р¶РµРЅРёСЏ/Feedback/%7B32E9312F-9319-4BB1-BA46-C2BDFFF98573%7D/Capture001.png
    2022-02-24 19:42:27  vlads@file:///C:/Users/vlads/OneDrive/Р Р°Р±РѕС‡РёР№%20СЃС‚РѕР»/РћС‚С‡РµС‚%20-%20РєРѕРјРїСЊСЋРµС‚СЂ
    2022-02-24 19:43:01  vlads@file:///C:/Users/vlads/AppData/Local/Temp/rpt-4.txt
    2022-02-24 19:43:52  vlads@file:///C:/Users/vlads/OneDrive/Р Р°Р±РѕС‡РёР№%20СЃС‚РѕР»/РћС‚С‡РµС‚%20-%20РїР»Р°С‚Р°
    2022-02-24 19:43:58  vlads@file:///C:/Users/vlads/OneDrive/Р Р°Р±РѕС‡РёР№%20СЃС‚РѕР»/РћС‚С‡РµС‚%20-%20РїР»Р°С‚Р°.txt
    2022-02-24 19:48:34  vlads@file:///C:/Users/vlads/OneDrive/Р Р°Р±РѕС‡РёР№%20СЃС‚РѕР»/РџР»Р°С‚Р°%202
    2022-02-24 19:48:40  vlads@file:///C:/Users/vlads/OneDrive/Р Р°Р±РѕС‡РёР№%20СЃС‚РѕР»/РџР»Р°С‚Р°%202.txt
    2022-02-24 19:49:00  vlads@file:///C:/Users/vlads/AppData/Local/Temp/rpt-3.txt
    2022-02-24 19:49:05  vlads@file:///C:/Users/vlads/OneDrive/Р Р°Р±РѕС‡РёР№%20СЃС‚РѕР»/РџР»Р°С‚Р°2
    2022-02-24 19:49:11  vlads@file:///C:/Users/vlads/OneDrive/Р Р°Р±РѕС‡РёР№%20СЃС‚РѕР»/РџР»Р°С‚Р°2.txt
    2022-02-24 19:52:11  vlads@file:///C:/Users/vlads/AppData/Local/Temp/rpt-2.txt
    2022-02-24 19:52:46  vlads@file:///C:/Users/vlads/OneDrive/Р Р°Р±РѕС‡РёР№%20СЃС‚РѕР»/РћС‚С‡РµС‚%20-%20РїР°РјСЏС‚СЊ


--------[ Debug - PCI ]-------------------------------------------------------------------------------------------------

    B00 D00 F00:  Intel Haswell-DT - Host Bridge/DRAM Controller
                  
      Offset 000:  86 80 00 0C  06 00 90 20  06 00 00 06  00 00 00 00 
      Offset 010:  00 00 00 00  00 00 00 00  00 00 00 00  00 00 00 00 
      Offset 020:  00 00 00 00  00 00 00 00  00 00 00 00  AA 17 7D 36 
      Offset 030:  00 00 00 00  E0 00 00 00  00 00 00 00  00 00 00 00 
      Offset 040:  01 90 D1 FE  00 00 00 00  01 00 D1 FE  00 00 00 00 
      Offset 050:  03 00 00 00  09 00 00 00  04 00 00 00  01 00 00 DF 
      Offset 060:  05 00 00 F8  00 00 00 00  01 80 D1 FE  00 00 00 00 
      Offset 070:  00 00 00 FF  01 00 00 00  00 0C 00 FF  7F 00 00 00 
      Offset 080:  10 00 00 00  00 00 00 00  1A 00 00 00  00 00 00 00 
      Offset 090:  01 00 00 FF  01 00 00 00  01 00 F0 1E  02 00 00 00 
      Offset 0A0:  01 00 00 00  02 00 00 00  01 00 00 1F  02 00 00 00 
      Offset 0B0:  01 00 00 E0  01 00 00 E0  01 00 00 DF  01 00 00 E0 
      Offset 0C0:  00 00 00 00  00 00 00 00  00 00 00 00  00 00 00 00 
      Offset 0D0:  00 00 00 00  00 00 00 00  00 00 00 00  00 00 00 00 
      Offset 0E0:  09 00 0C 01  61 E0 04 62  D0 00 54 56  00 00 00 00 
      Offset 0F0:  00 00 00 00  C8 0F 03 00  00 00 00 00  00 00 00 00 

    B00 D01 F00:  Intel Haswell - PCI Express x16 Controller
                  
      Offset 000:  86 80 01 0C  07 04 10 00  06 00 04 06  10 00 81 00 
      Offset 010:  00 00 00 00  00 00 00 00  00 01 01 00  E0 E0 00 20 
      Offset 020:  00 F6 00 F7  01 E8 F1 F1  00 00 00 00  00 00 00 00 
      Offset 030:  00 00 00 00  88 00 00 00  00 00 00 00  00 01 18 00 
      Offset 040:  00 00 00 00  00 00 00 00  00 00 00 00  00 00 00 00 
      Offset 050:  00 00 00 00  00 00 00 00  00 00 00 00  00 00 00 00 
      Offset 060:  00 00 00 00  00 00 00 00  00 00 00 00  00 00 00 00 
      Offset 070:  00 00 00 00  00 00 00 00  00 00 00 00  00 00 00 0A 
      Offset 080:  01 90 03 C8  08 00 00 00  0D 80 00 00  AA 17 7D 36 
      Offset 090:  05 A0 01 00  38 01 E0 FE  00 00 00 00  00 00 00 00 
      Offset 0A0:  10 00 42 01  00 80 00 00  00 00 00 00  02 AD 61 02 
      Offset 0B0:  41 00 82 D0  80 25 0C 00  00 00 40 00  08 00 00 00 
      Offset 0C0:  00 00 00 00  80 0B 08 00  00 04 00 00  06 00 00 00 
      Offset 0D0:  42 00 01 00  00 00 00 00  00 00 00 00  00 00 00 00 
      Offset 0E0:  00 00 00 00  00 00 00 00  00 00 00 00  00 00 00 00 
      Offset 0F0:  00 60 01 00  4E 01 01 40  00 00 00 00  00 00 10 00 

    B00 D14 F00:  Intel Lynx Point PCH - USB 3.0 xHCI Host Controller [C2]
                  
      Offset 000:  86 80 31 8C  06 04 90 02  05 30 03 0C  00 00 00 00 
      Offset 010:  04 00 20 F7  00 00 00 00  00 00 00 00  00 00 00 00 
      Offset 020:  00 00 00 00  00 00 00 00  00 00 00 00  AA 17 7D 36 
      Offset 030:  00 00 00 00  70 00 00 00  00 00 00 00  00 01 00 00 
      Offset 040:  FD 01 36 80  89 C6 0F 80  00 00 00 00  00 00 00 00 
      Offset 050:  9F 6E 88 07  00 00 00 00  00 00 00 00  00 00 00 00 
      Offset 060:  30 20 00 00  00 00 00 00  00 00 00 00  00 00 00 00 
      Offset 070:  01 80 C2 C1  08 00 00 00  00 00 00 00  00 00 00 00 
      Offset 080:  05 00 87 00  58 02 E0 FE  00 00 00 00  00 00 00 00 
      Offset 090:  00 00 00 00  00 00 00 00  00 00 00 00  00 00 00 00 
      Offset 0A0:  40 01 00 00  00 00 00 00  00 00 00 00  00 00 00 00 
      Offset 0B0:  0F 00 01 00  00 00 00 00  00 00 00 00  00 00 00 00 
      Offset 0C0:  03 0C 00 20  00 00 0F 00  03 0C 30 00  00 00 00 00 
      Offset 0D0:  FF 00 00 00  FF 00 00 00  03 00 00 00  03 00 00 00 
      Offset 0E0:  F4 01 00 00  00 00 00 00  00 00 00 00  D8 D8 D8 08 
      Offset 0F0:  00 00 00 00  00 00 00 00  B1 0F 06 08  00 00 00 00 

    B00 D16 F00:  Intel Lynx Point PCH - Host Embedded Controller Interface 1 (HECI1) [C1]
                  
      Offset 000:  86 80 3A 8C  06 04 10 00  04 00 80 07  00 00 80 00 
      Offset 010:  04 A0 21 F7  00 00 00 00  00 00 00 00  00 00 00 00 
      Offset 020:  00 00 00 00  00 00 00 00  00 00 00 00  AA 17 7D 36 
      Offset 030:  00 00 00 00  50 00 00 00  00 00 00 00  00 01 00 00 
      Offset 040:  45 02 00 1E  10 00 01 80  06 23 00 60  F0 1F 00 10 
      Offset 050:  01 8C 03 C8  08 00 00 00  00 00 00 00  00 00 00 00 
      Offset 060:  00 02 00 00  00 00 00 00  00 00 00 00  00 00 00 00 
      Offset 070:  00 00 00 00  00 00 00 E0  00 00 00 00  00 00 00 00 
      Offset 080:  00 00 00 00  00 00 00 00  00 00 00 00  05 00 81 00 
      Offset 090:  38 02 E0 FE  00 00 00 00  00 00 00 00  00 00 00 00 
      Offset 0A0:  00 00 00 00  00 00 00 00  00 00 00 00  00 00 00 00 
      Offset 0B0:  00 00 00 00  00 00 00 00  00 00 00 00  02 00 00 C0 
      Offset 0C0:  55 D9 46 C0  38 60 05 52  76 F6 63 4E  79 FF 87 8E 
      Offset 0D0:  07 10 99 F0  1C 95 6D 24  31 94 AE E6  67 B7 F5 B6 
      Offset 0E0:  00 00 00 00  00 00 00 00  00 00 00 00  00 00 00 00 
      Offset 0F0:  00 00 00 00  00 00 00 00  00 00 00 00  00 00 00 00 

    B00 D1A F00:  Intel Lynx Point PCH - USB 2.0 EHCI Host Controller 2 [C2]
                  
      Offset 000:  86 80 2D 8C  06 00 90 02  05 20 03 0C  00 00 00 00 
      Offset 010:  00 80 21 F7  00 00 00 00  00 00 00 00  00 00 00 00 
      Offset 020:  00 00 00 00  00 00 00 00  00 00 00 00  AA 17 7D 36 
      Offset 030:  00 00 00 00  50 00 00 00  00 00 00 00  10 01 00 00 
      Offset 040:  00 00 00 00  4D 1C 99 3D  00 00 00 00  00 00 00 00 
      Offset 050:  01 58 C2 C9  00 00 00 00  0A 98 A0 20  00 00 00 00 
      Offset 060:  20 20 FF 07  00 00 00 00  01 00 00 00  00 20 00 C0 
      Offset 070:  00 00 DF 3F  00 00 0F 00  4F 01 00 00  8C 40 00 00 
      Offset 080:  00 00 80 00  11 88 0C 93  70 0D 00 24  01 04 02 00 
      Offset 090:  00 00 00 00  00 00 00 00  13 00 06 03  00 00 00 00 
      Offset 0A0:  00 00 00 00  00 00 00 00  00 00 00 00  00 00 00 00 
      Offset 0B0:  00 00 00 00  00 00 00 00  00 00 00 00  00 00 00 00 
      Offset 0C0:  00 00 00 00  00 00 00 00  00 00 00 00  00 00 00 00 
      Offset 0D0:  00 00 00 00  00 AA FF 00  00 00 FF FF  27 00 00 00 
      Offset 0E0:  00 00 00 00  00 00 00 00  00 00 00 00  04 80 BE DD 
      Offset 0F0:  00 00 00 00  88 85 80 00  B1 0F 06 08  08 17 1A 20 

    B00 D1B F00:  Intel Lynx Point PCH - High Definition Audio Controller [C2]
                  
      Offset 000:  86 80 20 8C  06 00 10 00  05 00 03 04  10 00 00 00 
      Offset 010:  04 C0 AF FE  00 00 00 00  00 00 00 00  00 00 00 00 
      Offset 020:  00 00 00 00  00 00 00 00  00 00 00 00  AA 17 7D 36 
      Offset 030:  00 00 00 00  50 00 00 00  00 00 00 00  16 01 00 00 
      Offset 040:  03 00 00 17  00 00 00 00  00 00 00 00  00 80 00 00 
      Offset 050:  01 60 42 C8  00 00 00 00  00 00 00 00  00 00 00 00 
      Offset 060:  05 70 80 00  00 00 00 00  00 00 00 00  00 00 00 00 
      Offset 070:  10 00 91 00  00 00 00 10  00 08 10 00  00 00 00 00 
      Offset 080:  00 00 00 00  00 00 00 00  00 00 00 00  00 00 00 00 
      Offset 090:  00 00 00 00  00 00 00 00  00 00 00 00  00 00 00 00 
      Offset 0A0:  00 00 00 00  00 00 00 00  00 00 00 00  00 00 00 00 
      Offset 0B0:  00 00 00 00  00 00 00 00  00 00 00 00  00 00 00 00 
      Offset 0C0:  00 04 02 01  00 60 00 00  00 0C 85 82  10 00 33 02 
      Offset 0D0:  00 0C 85 02  10 00 33 02  00 00 00 00  00 00 00 00 
      Offset 0E0:  00 00 00 00  00 00 00 00  00 00 00 00  00 00 00 00 
      Offset 0F0:  00 00 00 00  00 00 00 00  B1 0F 06 08  00 00 00 00 

    B00 D1C F00:  Intel Lynx Point PCH - PCI Express Root Port 1 [C2]
                  
      Offset 000:  86 80 10 8C  04 04 10 00  D5 00 04 06  10 00 81 00 
      Offset 010:  00 00 00 00  00 00 00 00  00 02 02 00  F0 00 00 20 
      Offset 020:  F0 FF 00 00  F1 FF 01 00  00 00 00 00  00 00 00 00 
      Offset 030:  00 00 00 00  40 00 00 00  00 00 00 00  00 01 00 00 
      Offset 040:  10 80 42 01  00 80 00 00  00 00 10 00  12 4C 31 01 
      Offset 050:  03 00 01 10  60 00 04 00  28 10 00 00  08 00 00 00 
      Offset 060:  00 00 00 00  17 08 08 00  00 04 00 00  00 00 00 00 
      Offset 070:  01 00 01 00  00 00 00 00  00 00 00 00  00 00 00 00 
      Offset 080:  05 90 01 00  78 01 E0 FE  00 00 00 00  00 00 00 00 
      Offset 090:  0D A0 00 00  AA 17 7D 36  00 00 00 00  00 00 00 00 
      Offset 0A0:  01 00 03 C8  00 00 00 00  00 00 00 00  00 00 00 00 
      Offset 0B0:  00 00 00 00  00 00 00 00  00 00 00 00  00 00 00 00 
      Offset 0C0:  00 00 00 00  00 00 00 00  00 00 00 00  00 00 00 00 
      Offset 0D0:  00 00 00 01  00 08 00 00  02 00 11 09  00 00 00 00 
      Offset 0E0:  00 3F 00 00  00 00 00 00  03 00 00 00  00 00 00 00 
      Offset 0F0:  50 00 00 00  80 F5 00 00  B1 0F 06 08  B0 03 02 01 

    B00 D1C F02:  Intel Lynx Point PCH - PCI Express Root Port 3 [C2]
                  
      Offset 000:  86 80 14 8C  07 04 10 00  D5 00 04 06  10 00 81 00 
      Offset 010:  00 00 00 00  00 00 00 00  00 03 03 00  D0 D0 00 00 
      Offset 020:  10 F7 10 F7  11 F2 11 F2  00 00 00 00  00 00 00 00 
      Offset 030:  00 00 00 00  40 00 00 00  00 00 00 00  00 03 00 00 
      Offset 040:  10 80 42 01  00 80 00 00  00 00 10 00  12 3C 32 03 
      Offset 050:  40 00 11 70  00 B2 14 00  00 00 40 00  08 00 00 00 
      Offset 060:  00 00 00 00  17 08 00 00  00 04 00 00  00 00 00 00 
      Offset 070:  02 00 01 00  00 00 00 00  00 00 00 00  00 00 00 00 
      Offset 080:  05 90 01 00  58 01 E0 FE  00 00 00 00  00 00 00 00 
      Offset 090:  0D A0 00 00  AA 17 7D 36  00 00 00 00  00 00 00 00 
      Offset 0A0:  01 00 03 C8  00 00 00 00  00 00 00 00  00 00 00 00 
      Offset 0B0:  00 00 00 00  00 00 00 00  00 00 00 00  00 00 00 00 
      Offset 0C0:  00 00 00 00  00 00 00 00  00 00 00 00  00 00 00 00 
      Offset 0D0:  00 00 00 01  02 08 00 00  08 80 11 0B  00 00 00 00 
      Offset 0E0:  00 03 00 00  00 00 3C 88  11 00 00 00  00 00 00 00 
      Offset 0F0:  50 00 00 00  40 00 00 0C  B1 0F 06 08  B0 03 00 03 

    B00 D1D F00:  Intel Lynx Point PCH - USB 2.0 EHCI Host Controller 1 [C2]
                  
      Offset 000:  86 80 26 8C  06 00 90 02  05 20 03 0C  00 00 00 00 
      Offset 010:  00 70 21 F7  00 00 00 00  00 00 00 00  00 00 00 00 
      Offset 020:  00 00 00 00  00 00 00 00  00 00 00 00  AA 17 7D 36 
      Offset 030:  00 00 00 00  50 00 00 00  00 00 00 00  17 01 00 00 
      Offset 040:  00 00 00 00  DB 05 9A 09  00 00 00 00  00 00 00 00 
      Offset 050:  01 58 C2 C9  00 00 00 00  0A 98 A0 20  00 00 00 00 
      Offset 060:  20 20 FF 07  00 00 00 00  01 00 00 00  00 20 00 C0 
      Offset 070:  00 00 DF 3F  03 0C 00 20  4F 01 00 00  8C 40 00 00 
      Offset 080:  00 00 80 00  11 88 0C 93  70 0D 00 24  01 04 02 00 
      Offset 090:  00 00 00 00  00 00 00 00  13 00 06 03  00 00 00 00 
      Offset 0A0:  00 00 00 00  00 00 00 00  00 00 00 00  00 00 00 00 
      Offset 0B0:  00 00 00 00  00 00 00 00  00 00 00 00  00 00 00 00 
      Offset 0C0:  00 00 00 00  00 00 00 00  00 00 00 00  00 00 00 00 
      Offset 0D0:  00 00 00 00  00 AA FF 00  00 00 F3 40  27 00 00 00 
      Offset 0E0:  00 00 00 00  FF FF FF FF  FF FF FF FF  04 50 B2 DD 
      Offset 0F0:  00 00 00 00  88 85 80 00  B1 0F 06 08  08 17 1A 20 

    B00 D1F F00:  Intel H81 Chipset - LPC Interface Controller [C2]
                  
      Offset 000:  86 80 5C 8C  07 00 10 02  05 00 01 06  00 00 80 00 
      Offset 010:  00 00 00 00  00 00 00 00  00 00 00 00  00 00 00 00 
      Offset 020:  00 00 00 00  00 00 00 00  00 00 00 00  AA 17 7D 36 
      Offset 030:  00 00 00 00  E0 00 00 00  00 00 00 00  00 00 00 00 
      Offset 040:  01 18 00 00  80 00 00 00  01 1C 00 00  10 00 00 00 
      Offset 050:  F8 00 00 00  00 00 00 00  00 00 00 00  00 00 00 00 
      Offset 060:  80 80 80 80  90 00 00 00  80 80 80 80  F8 F0 00 00 
      Offset 070:  78 F0 78 F0  78 F0 78 F0  78 F0 78 F0  78 F0 78 F0 
      Offset 080:  00 00 00 14  01 0A 3C 00  00 00 00 00  00 00 00 00 
      Offset 090:  00 00 00 00  00 0F 00 00  00 00 00 00  00 00 00 00 
      Offset 0A0:  18 5E 80 60  09 18 06 00  00 46 00 00  00 00 01 80 
      Offset 0B0:  00 00 00 00  00 00 00 00  00 00 00 10  00 00 00 00 
      Offset 0C0:  00 00 00 00  00 00 00 00  00 00 00 00  00 00 00 00 
      Offset 0D0:  33 22 11 00  67 45 00 00  CF FF 00 00  22 00 00 00 
      Offset 0E0:  09 00 0C 10  00 00 00 00  01 01 F1 91  00 00 00 00 
      Offset 0F0:  01 C0 D1 FE  00 00 00 00  B1 0F 06 08  00 00 00 00 

    B00 D1F F02:  Intel Lynx Point PCH - SATA AHCI Controller (Ports 0-5) [C2]
                  
      Offset 000:  86 80 02 8C  07 04 B0 02  05 01 06 01  00 00 00 00 
      Offset 010:  71 F0 00 00  61 F0 00 00  51 F0 00 00  41 F0 00 00 
      Offset 020:  21 F0 00 00  00 60 21 F7  00 00 00 00  AA 17 7D 36 
      Offset 030:  00 00 00 00  80 00 00 00  00 00 00 00  00 02 00 00 
      Offset 040:  00 80 00 80  00 00 00 00  00 00 00 00  00 00 00 00 
      Offset 050:  00 00 00 00  00 00 00 00  00 00 00 00  00 00 00 00 
      Offset 060:  00 00 00 00  00 00 00 00  00 00 00 00  00 00 00 00 
      Offset 070:  01 A8 03 40  08 00 00 00  00 00 00 00  00 00 00 00 
      Offset 080:  05 70 01 00  98 01 E0 FE  00 00 00 00  00 00 00 00 
      Offset 090:  60 0C 33 A3  83 01 00 0C  20 02 5C E0  21 00 00 80 
      Offset 0A0:  A8 00 00 00  00 00 00 00  12 00 10 00  48 00 00 00 
      Offset 0B0:  00 00 00 00  00 00 00 00  00 00 00 00  00 00 00 00 
      Offset 0C0:  00 00 00 00  00 00 00 00  00 00 00 00  00 00 00 00 
      Offset 0D0:  00 00 00 00  00 00 00 00  00 00 00 00  00 00 00 00 
      Offset 0E0:  00 00 00 00  00 00 00 00  00 00 00 00  00 00 00 00 
      Offset 0F0:  00 00 00 00  00 00 00 00  B1 0F 06 08  00 00 00 00 

    B00 D1F F03:  Intel Lynx Point PCH - SMBus Controller [C2]
                  
      Offset 000:  86 80 22 8C  00 04 80 02  05 00 05 0C  00 00 00 00 
      Offset 010:  04 50 21 F7  00 00 00 00  00 00 00 00  00 00 00 00 
      Offset 020:  01 F0 00 00  00 00 00 00  00 00 00 00  AA 17 7D 36 
      Offset 030:  00 00 00 00  00 00 00 00  00 00 00 00  12 03 00 00 
      Offset 040:  10 00 00 00  00 00 00 00  00 00 00 00  00 00 00 00 
      Offset 050:  00 00 00 00  00 00 00 00  00 00 00 00  00 00 00 00 
      Offset 060:  03 04 04 00  00 00 08 08  00 00 00 00  00 00 00 00 
      Offset 070:  00 00 00 00  00 00 00 00  00 00 00 00  00 00 00 00 
      Offset 080:  04 00 00 00  00 00 00 00  00 00 00 00  00 00 00 00 
      Offset 090:  00 00 00 00  00 00 00 00  00 00 00 00  00 00 00 00 
      Offset 0A0:  00 00 00 00  00 00 00 00  00 00 00 00  00 00 00 00 
      Offset 0B0:  00 00 00 00  00 00 00 00  00 00 00 00  00 00 00 00 
      Offset 0C0:  00 00 00 00  00 00 00 00  00 00 00 00  00 00 00 00 
      Offset 0D0:  00 00 00 00  00 00 00 00  00 00 00 00  00 00 00 00 
      Offset 0E0:  00 00 00 00  00 00 00 00  00 00 00 00  00 00 00 00 
      Offset 0F0:  00 00 00 00  00 00 00 00  B1 0F 06 08  00 00 00 00 

    B00 D1F F06:  Intel Lynx Point PCH - Thermal Controller [C2]
                  
      Offset 000:  86 80 24 8C  00 00 10 00  05 00 80 11  00 00 00 00 
      Offset 010:  04 00 00 00  00 00 00 00  00 00 00 00  00 00 00 00 
      Offset 020:  00 00 00 00  00 00 00 00  00 00 00 00  AA 17 7D 36 
      Offset 030:  00 00 00 00  50 00 00 00  00 00 00 00  FF 03 00 00 
      Offset 040:  05 F0 FD F7  00 00 00 00  00 00 00 00  00 00 00 00 
      Offset 050:  01 80 23 00  08 00 00 00  00 00 00 00  00 00 00 00 
      Offset 060:  00 00 00 00  00 00 00 00  00 00 00 00  00 00 00 00 
      Offset 070:  00 00 00 00  00 00 00 00  00 00 00 00  00 00 00 00 
      Offset 080:  05 00 00 00  00 00 00 00  00 00 00 00  00 00 00 00 
      Offset 090:  00 00 00 00  00 00 00 00  00 00 00 00  00 00 00 00 
      Offset 0A0:  00 00 00 00  00 00 00 00  00 00 00 00  00 00 00 00 
      Offset 0B0:  00 00 00 00  00 00 00 00  00 00 00 00  00 00 00 00 
      Offset 0C0:  00 00 00 00  00 00 00 00  00 00 00 00  00 00 00 00 
      Offset 0D0:  00 00 00 00  00 00 00 00  00 00 00 00  00 00 00 00 
      Offset 0E0:  00 00 00 00  00 00 00 00  00 00 00 00  00 00 00 00 
      Offset 0F0:  00 00 00 00  00 00 00 00  B1 0F 06 08  00 00 00 00 

    B01 D00 F00:  MSI N635GT (MS-V292) Video Adapter
                  
      Offset 000:  DE 10 80 12  07 00 10 00  A1 00 00 03  10 00 80 00 
      Offset 010:  00 00 00 F6  0C 00 00 E8  00 00 00 00  0C 00 00 F0 
      Offset 020:  00 00 00 00  01 E0 00 00  00 00 00 00  62 14 22 29 
      Offset 030:  00 00 00 00  60 00 00 00  00 00 00 00  10 01 00 00 
      Offset 040:  62 14 22 29  00 00 00 00  00 00 00 00  00 00 00 00 
      Offset 050:  00 00 00 00  01 00 00 00  CE D6 23 00  00 00 00 00 
      Offset 060:  01 68 03 00  08 00 00 00  05 78 80 00  00 00 00 00 
      Offset 070:  00 00 00 00  00 00 00 00  10 00 12 00  E1 8D 2C 01 
      Offset 080:  10 21 00 00  82 3C 45 00  41 01 82 10  00 00 00 00 
      Offset 090:  00 00 00 00  00 00 00 00  00 00 00 00  13 00 00 00 
      Offset 0A0:  00 00 00 00  06 00 00 00  02 00 01 00  00 00 00 00 
      Offset 0B0:  00 00 00 00  09 00 14 01  00 00 00 00  00 00 00 00 
      Offset 0C0:  00 00 00 00  00 00 00 00  00 00 00 00  00 00 00 00 
      Offset 0D0:  00 00 00 00  00 00 00 00  00 00 00 00  00 00 00 00 
      Offset 0E0:  00 00 00 00  00 00 00 00  00 00 00 00  00 00 00 00 
      Offset 0F0:  00 00 00 00  00 00 00 00  00 00 00 00  00 00 00 00 

    B01 D00 F01:  nVIDIA GK208 - High Definition Audio Controller
                  
      Offset 000:  DE 10 0F 0E  06 00 10 00  A1 00 03 04  10 00 80 00 
      Offset 010:  00 C0 0F F7  00 00 00 00  00 00 00 00  00 00 00 00 
      Offset 020:  00 00 00 00  00 00 00 00  00 00 00 00  62 14 22 29 
      Offset 030:  00 00 00 00  60 00 00 00  00 00 00 00  11 02 00 00 
      Offset 040:  62 14 22 29  00 00 00 00  00 00 00 00  00 00 00 00 
      Offset 050:  00 00 00 00  00 00 00 00  CE D6 23 00  00 00 00 00 
      Offset 060:  01 68 03 00  08 00 00 00  05 78 80 00  00 00 00 00 
      Offset 070:  00 00 00 00  00 00 00 00  10 00 02 00  E1 8D 2C 01 
      Offset 080:  00 21 00 00  82 3C 45 00  03 01 82 10  00 00 00 00 
      Offset 090:  00 00 00 00  00 00 00 00  00 00 00 00  13 00 00 00 
      Offset 0A0:  00 00 00 00  06 00 00 00  00 00 01 00  00 00 00 00 
      Offset 0B0:  00 00 00 00  00 00 00 00  00 00 00 00  00 00 00 00 
      Offset 0C0:  00 00 00 00  00 00 00 00  00 00 00 00  00 00 00 00 
      Offset 0D0:  00 00 00 00  00 00 00 00  00 00 00 00  00 00 00 00 
      Offset 0E0:  00 00 00 00  00 00 00 00  00 00 00 00  00 00 00 00 
      Offset 0F0:  00 00 00 00  00 00 00 00  00 00 00 00  00 00 00 00 

    B03 D00 F00:  Realtek RTL8168/8111 PCI-E Gigabit Ethernet Adapter
                  
      Offset 000:  EC 10 68 81  07 04 10 00  0C 00 00 02  10 00 00 00 
      Offset 010:  01 D0 00 00  00 00 00 00  04 00 10 F7  00 00 00 00 
      Offset 020:  0C 00 10 F2  00 00 00 00  00 00 00 00  AA 17 7D 36 
      Offset 030:  00 00 00 00  40 00 00 00  00 00 00 00  00 01 00 00 
      Offset 040:  01 50 C3 FF  08 00 00 00  00 00 00 00  00 00 00 00 
      Offset 050:  05 70 80 00  00 00 00 00  00 00 00 00  00 00 00 00 
      Offset 060:  00 00 00 00  00 00 00 00  00 00 00 00  00 00 00 00 
      Offset 070:  10 B0 02 02  C0 8C 90 05  07 20 10 00  11 7C 47 00 
      Offset 080:  40 00 11 10  00 00 00 00  00 00 00 00  00 00 00 00 
      Offset 090:  00 00 00 00  1F 08 0C 00  10 04 00 00  02 00 00 00 
      Offset 0A0:  00 00 00 00  00 00 00 00  00 00 00 00  00 00 00 00 
      Offset 0B0:  11 D0 03 80  04 00 00 00  04 08 00 00  00 00 00 00 
      Offset 0C0:  00 00 00 00  00 00 00 00  00 00 00 00  00 00 00 00 
      Offset 0D0:  03 00 FC 80  FF FF FF FF  00 00 00 00  00 00 00 00 
      Offset 0E0:  00 00 00 00  00 00 00 00  00 00 00 00  00 00 00 00 
      Offset 0F0:  00 00 00 00  00 00 00 00  00 00 00 00  00 00 00 00 

    PCI-8086-0C00:  Intel SNB/IVB/HSW/CRW/BDW/SKL/KBL/CFL/WHL/CNL/CML/ICL/RKL/TGL/JSL MCHBAR
                  
      Offset 4000:  C6 50 44 10  03 41 22 82  45 55 AB 0A  CA 64 29 05
      Offset 4010:  08 00 00 00  C6 14 00 00  00 00 00 00  00 00 00 00
      Offset 4020:  00 00 10 00  20 20 20 20  00 00 0E 00  00 00 00 00
      Offset 4030:  00 00 00 00  00 00 00 00  00 00 00 00  00 00 00 00
      Offset 4040:  49 C0 00 00  00 00 00 00  56 34 12 00  EF CD AB 00
      Offset 4050:  43 65 87 00  56 34 12 00  EF CD AB 00  43 65 87 00
      Offset 4060:  00 00 00 00  00 00 00 00  00 00 00 00  00 00 00 00
      Offset 4070:  00 00 00 00  00 00 00 00  00 01 01 01  00 00 00 00
      Offset 4080:  00 00 00 00  00 00 00 00  00 00 00 00  00 00 00 00

    PCI-8086-0C00:  Intel SNB/IVB/HSW/CRW/BDW/SKL/KBL/CFL/WHL/CNL/CML/ICL/RKL/TGL/JSL MCHBAR
                  
      Offset 4200:  00 00 3F 00  00 00 00 00  00 00 00 00  00 00 00 00
      Offset 4210:  00 00 00 00  00 00 00 00  00 00 00 00  00 00 00 00
      Offset 4220:  00 00 00 00  00 00 00 00  00 00 00 00  00 00 00 00
      Offset 4230:  00 00 00 00  00 00 00 00  00 00 00 00  00 00 00 00
      Offset 4240:  00 00 00 00  00 00 00 00  00 00 00 00  00 00 00 00
      Offset 4250:  00 00 00 00  00 00 00 00  00 00 00 00  00 00 00 00
      Offset 4260:  00 00 00 00  00 00 00 00  00 00 00 00  00 00 00 00
      Offset 4270:  00 00 00 00  00 00 00 00  00 00 00 00  00 00 00 00
      Offset 4280:  00 00 00 00  00 00 00 00  00 00 00 00  00 00 00 00
      Offset 4290:  80 40 00 00  0F 98 00 00  04 10 B4 46  00 00 00 00
      Offset 42A0:  00 00 00 00  00 B2 00 01  00 00 00 00  00 00 00 00

    PCI-8086-0C00:  Intel SNB/IVB/HSW/CRW/BDW/SKL/KBL/CFL/WHL/CNL/CML/ICL/RKL/TGL/JSL MCHBAR
                  
      Offset 4400:  6B 71 86 15  84 41 33 08  D4 10 EF B0  54 DD 5A 0B
      Offset 4410:  07 00 00 00  0B D5 00 00  00 00 00 00  00 00 00 00
      Offset 4420:  00 00 10 00  2A 2A 00 00  33 00 15 00  00 00 00 00
      Offset 4430:  00 00 00 00  00 00 00 00  00 00 00 00  00 00 00 00
      Offset 4440:  49 C0 00 00  00 00 00 00  A1 0C A1 00  08 0D EF 00
      Offset 4450:  1E 0A AD 00  A1 0C A1 00  08 0D EF 00  1E 0A AD 00
      Offset 4460:  A1 0C A1 00  08 0D EF 00  1E 0A AD 00  A1 0C A1 00
      Offset 4470:  08 0D EF 00  1E 0A AD 00  02 01 01 0A  00 00 00 00
      Offset 4480:  00 00 00 00  00 00 00 00  00 00 00 00  00 00 00 00

    PCI-8086-0C00:  Intel SNB/IVB/HSW/CRW/BDW/SKL/KBL/CFL/WHL/CNL/CML/ICL/RKL/TGL/JSL MCHBAR
                  
      Offset 4600:  00 00 3F 00  00 00 00 00  00 00 00 00  00 00 00 00
      Offset 4610:  00 00 00 00  00 00 00 00  00 00 00 00  00 00 00 00
      Offset 4620:  00 00 00 00  00 00 00 00  00 00 00 00  00 00 00 00
      Offset 4630:  00 00 00 00  00 00 00 00  00 00 00 00  00 00 00 00
      Offset 4640:  00 00 00 00  00 00 00 00  00 00 00 00  00 00 00 00
      Offset 4650:  00 00 00 00  00 00 00 00  00 00 00 00  00 00 00 00
      Offset 4660:  00 00 00 00  00 00 00 00  00 00 00 00  00 00 00 00
      Offset 4670:  00 00 00 00  00 00 00 00  00 00 00 00  00 00 00 00
      Offset 4680:  00 00 00 00  00 00 00 00  00 00 00 00  00 00 00 00
      Offset 4690:  80 40 00 00  FF 98 00 00  60 18 D0 6C  58 42 00 00
      Offset 46A0:  03 00 00 00  00 82 00 41  00 00 00 00  00 00 00 00

    PCI-8086-0C00:  Intel SNB/IVB/HSW/CRW/BDW/SKL/KBL/CFL/WHL/CNL/CML/ICL/RKL/TGL/JSL MCHBAR
                  
      Offset 4800:  00 00 00 00  00 00 03 00  00 00 00 08  00 00 00 08
      Offset 4810:  00 00 00 08  00 00 00 08  00 00 00 08  00 00 00 08

    PCI-8086-0C00:  Intel SNB/IVB/HSW/CRW/BDW/SKL/KBL/CFL/WHL/CNL/CML/ICL/RKL/TGL/JSL MCHBAR
                  
      Offset 4A80:  00 00 00 00  00 00 00 00  00 00 00 00  00 00 00 00
      Offset 4A90:  00 00 00 00  00 00 00 00  00 00 00 00  00 00 00 00

    PCI-8086-0C00:  Intel SNB/IVB/HSW/CRW/BDW/SKL/KBL/CFL/WHL/CNL/CML/ICL/RKL/TGL/JSL MCHBAR
                  
      Offset 5000:  21 00 00 00  00 00 60 00  20 00 62 00  00 00 60 00
      Offset 5010:  00 00 00 00  00 00 00 00  00 00 00 00  00 00 00 00

    PCI-8086-0C00:  Intel SNB/IVB/HSW/CRW/BDW/SKL/KBL/CFL/WHL/CNL/CML/ICL/RKL/TGL/JSL MCHBAR
                  
      Offset 5880:  60 00 00 00  04 00 00 00  00 11 00 00  00 00 00 00
      Offset 5890:  FF FF 00 00  FF FF 00 00  FF FF 00 00  FF FF 00 00
      Offset 58A0:  00 00 00 00  00 00 00 00  1E 2B 00 00  00 00 00 00
      Offset 58B0:  00 00 00 00  00 00 00 00  00 00 00 00  7F 00 00 00
      Offset 58C0:  00 00 00 00  00 00 00 00  00 00 00 00  00 00 00 00
      Offset 58D0:  FF FF 00 00  FF FF 00 00  FF FF 00 00  FF FF 00 00
      Offset 58E0:  00 00 00 00  DE 00 54 00  10 34 3C 02  00 00 00 00
      Offset 58F0:  00 00 00 00  00 00 00 00  00 00 00 00  00 00 20 31
      Offset 5900:  00 00 00 00  00 00 00 0D  00 00 00 00  00 00 00 00
      Offset 5910:  00 00 00 00  00 00 00 00  00 00 00 00  00 00 00 00
      Offset 5920:  00 00 00 00  10 00 00 00  DF A7 DF 08  00 00 00 00
      Offset 5930:  A0 02 00 00  00 00 00 00  03 0E 0A 00  EE 7E 2D 0F
      Offset 5940:  00 00 00 00  00 00 00 00  00 00 00 00  00 00 00 00
      Offset 5950:  00 00 00 00  00 00 04 00  00 22 01 F3  28 08 08 00
      Offset 5960:  00 00 00 00  6C 74 1E 54  F5 2F CA 47  CB 77 F0 0C
      Offset 5970:  00 00 00 00  00 00 00 00  26 00 00 00  26 00 00 00
      Offset 5980:  23 00 00 00  9F E9 90 32  00 00 00 00  00 00 00 00
      Offset 5990:  FF 00 00 00  FF 00 00 00  18 07 04 00  00 14 64 00
      Offset 59A0:  00 00 00 00  00 00 00 00  00 00 00 00  00 00 00 00
      Offset 59B0:  F8 02 00 00  14 14 10 00  00 00 00 00  00 00 00 00
      Offset 59C0:  00 00 41 88  00 00 00 00  00 00 00 00  00 00 00 00

    PCI-8086-0C00:  Intel SNB/IVB/HSW/CRW/BDW/SKL/KBL/CFL/WHL/CNL/CML/ICL/RKL/TGL/JSL MCHBAR
                  
      Offset 5E00:  06 00 00 00  06 00 00 00  00 00 00 00  00 00 00 00
      Offset 5E10:  00 00 00 00  00 00 00 00  00 00 00 00  00 00 00 00

    PCI-8086-8C24:  Intel 8/9-series PCH TBAR
                  
      Offset 00:  B5 00 00 00  80 00 00 00  81 00 01 00  80 00 00 00
      Offset 10:  54 01 00 00  00 00 00 00  00 00 00 00  00 00 00 00
      Offset 20:  00 00 00 00  00 00 00 00  00 00 00 00  00 00 00 00
      Offset 30:  00 00 00 00  00 00 00 00  00 00 00 00  00 00 00 00
      Offset 40:  3C 09 85 B4  00 00 00 00  00 00 00 00  00 00 00 00
      Offset 50:  00 00 00 00  00 00 00 00  00 00 00 00  00 00 00 00
      Offset 60:  00 00 01 00  00 00 00 00  00 00 00 00  00 00 00 00
      Offset 70:  00 00 00 00  00 00 00 00  00 00 00 00  00 00 00 00
      Offset 80:  01 00 00 00


--------[ Debug - Video BIOS ]------------------------------------------------------------------------------------------

    C000:0000  ................................................................
    C000:0040  ................................................................
    C000:0080  ................................................................
    C000:00C0  ................................................................
    C000:0100  ................................................................
    C000:0140  ................................................................
    C000:0180  ................................................................
    C000:01C0  ................................................................
    C000:0200  ................................................................
    C000:0240  ................................................................
    C000:0280  ................................................................
    C000:02C0  ................................................................
    C000:0300  ................................................................
    C000:0340  ................................................................
    C000:0380  ................................................................
    C000:03C0  ................................................................


--------[ Debug - Unknown ]---------------------------------------------------------------------------------------------

    BIOS            Unknown
    Optical         MATSHITA DVD-RAM SW830
    SPD             No SPD module found! (BusCount = 0)


------------------------------------------------------------------------------------------------------------------------

The names of actual companies and products mentioned herein may be the trademarks of their respective owners.
